"ground_truth_output","num_queries","original_output","original_score","original_text","perturbed_output","perturbed_score","perturbed_text","result_type"
2.0,101.0,2.0,0.16666666666666663,"Fears for T N pension after talks Unions representing workers at Turner   Newall say they are 'disappointed' after talks with stricken parent firm Federal Mogul.",0.0,0.5,"Fears for T N pension after talks Unions representing functionaries at Turner   Newall say they are 'disappointed' after talks with stricken parent undertaking Federal Mogul.","Successful"
3.0,645.0,3.0,0.06666666666666665,"The Race is On: Second Private Team Sets Launch Date for Human Spaceflight (SPACE.com) SPACE.com - TORONTO, Canada -- A second\team of rocketeers competing for the  #36;10 million Ansari X Prize, a contest for\privately funded suborbital space flight, has officially announced the first\launch date for its manned rocket.",3.0,0.5,"The Race is On: Second Private Team Sets Launch Dating for Human Spaceflight (SPACE.com) SPACE.com - TORONTO, Canada -- A second\team of rocketeers competing for the  #36;10 million Ansari X Prize, a contest for\privately funded suborbital margin flight, has officially announced the first\launch date for its manned rocket.","Failed"
3.0,79.0,3.0,0.33333333333333337,"Ky. Company Wins Grant to Study Peptides (AP) AP - A company founded by a chemistry researcher at the University of Louisville won a grant to develop a method of producing better peptides, which are short chains of amino acids, the building blocks of proteins.",2.0,0.6,"Ky. Company Wins Grant to Study Peptides (AP) AP - A company founded by a chemistry researcher at the Fordham of Louisville won a grant to develop a method of producing better peptides, which are short chains of amino acids, the building blocks of proteins.","Successful"
3.0,1.0,2.0,0.8333333333333334,"Prediction Unit Helps Forecast Wildfires (AP) AP - It's barely dawn when Mike Fitzpatrick starts his shift with a blur of colorful maps, figures and endless charts, but already he knows what the day will bring. Lightning will strike in places he expects. Winds will pick up, moist places will dry and flames will roar.",2.0,0.8333333333333334,"Prediction Unit Helps Forecast Wildfires (AP) AP - It's barely dawn when Mike Fitzpatrick starts his shift with a blur of colorful maps, figures and endless charts, but already he knows what the day will bring. Lightning will strike in places he expects. Winds will pick up, moist places will dry and flames will roar.","Skipped"
3.0,57.0,3.0,0.5,"Calif. Aims to Limit Farm-Related Smog (AP) AP - Southern California's smog-fighting agency went after emissions of the bovine variety Friday, adopting the nation's first rules to reduce air pollution from dairy cow manure.",0.0,0.7,"Calif. Aims to Limit Farm-Related Smog (AP) AP - Southern California's smog-fighting agency went after broadcasting of the bovine variety Friday, adopting the nation's first rules to reduce air pollution from dairy cow manure.","Successful"
3.0,491.0,3.0,0.43333333333333335,"Open Letter Against British Copyright Indoctrination in Schools The British Department for Education and Skills (DfES) recently launched a ""Music Manifesto"" campaign, with the ostensible intention of educating the next generation of British musicians. Unfortunately, they also teamed up with the music industry (EMI, and various artists) to make this popular. EMI has apparently negotiated their end well, so that children in our schools will now be indoctrinated about the illegality of downloading music.The ignorance and audacity of this got to me a little, so I wrote an open letter to the DfES about it. Unfortunately, it's pedantic, as I suppose you have to be when writing to goverment representatives. But I hope you find it useful, and perhaps feel inspired to do something similar, if or when the same thing has happened in your area.",2.0,0.7,"Open Letter Against Uk Copyright Indoctrination in Schools The British Department for Education and Skills (DfES) recently launched a ""Music Manifesto"" campaign, with the ostensible intention of educating the next generation of British songwriters. Unfortunately, they also teamed up with the music industry (EMI, and various artists) to make this popular. EMI has apparently negotiated their end well, so that children in our schools will now be indoctrinated about the illegality of discharges music.The ignorance and audacity of this got to me a little, so I wrote an open letter to the DfES about it. Unfortunately, it's pedantic, as I suppose you have to be when writing to governing representatives. But I hope you find it useful, and perhaps feel inspired to do something similar, if or when the same thing has happened in your area.","Successful"
3.0,1188.0,3.0,0.06666666666666665,"Loosing the War on Terrorism \\""Sven Jaschan, self-confessed author of the Netsky and Sasser viruses, is\responsible for 70 percent of virus infections in 2004, according to a six-month\virus roundup published Wednesday by antivirus company Sophos.""\\""The 18-year-old Jaschan was taken into custody in Germany in May by police who\said he had admitted programming both the Netsky and Sasser worms, something\experts at Microsoft confirmed. (A Microsoft antivirus reward program led to the\teenager's arrest.) During the five months preceding Jaschan's capture, there\were at least 25 variants of Netsky and one of the port-scanning network worm\Sasser.""\\""Graham Cluley, senior technology consultant at Sophos, said it was staggeri ...\\",3.0,0.16666666666666663,"Loosing the War on Terrorism \\""Sven Jaschan, self-confessed author of the Netsky and Sasser viruses, is\responsible for 70 percent of virus infections in 2004, according to a six-month\virus roundup published Wednesday by avast company Sophos.""\\""The 18-year-old Jaschan was taken into custody in Germany in May by police who\said he had admitted programming both the Netsky and Sasser worms, something\scholar at Microsoft confirmed. (A Microsoft antivirus reward program led to the\teenager's arrest.) During the five months preceding Jaschan's capture, there\were at least 25 variants of Netsky and one of the port-scanning network worm\Sasser.""\\""Graham Cluley, senior technology consultant at Sophos, said it was staggeri ...\\","Failed"
3.0,1501.0,3.0,0.0,"FOAFKey: FOAF, PGP, Key Distribution, and Bloom Filters \\FOAF/LOAF  and bloom filters have a lot of interesting properties for social\network and whitelist distribution.\\I think we can go one level higher though and include GPG/OpenPGP key\fingerpring distribution in the FOAF file for simple web-of-trust based key\distribution.\\What if we used FOAF and included the PGP key fingerprint(s) for identities?\This could mean a lot.  You include the PGP key fingerprints within the FOAF\file of your direct friends and then include a bloom filter of the PGP key\fingerprints of your entire whitelist (the source FOAF file would of course need\to be encrypted ).\\Your whitelist would be populated from the social network as your client\discovered new identit ...\\",3.0,0.23333333333333328,"FOAFKey: FOAF, PGP, Key Distribution, and Bloom Filters \\FOAF/LOAF  and bloom filters have a lot of interesting properties for social\network and whitelist distribution.\\I think we can go one level higher though and include GPG/OpenPGP key\fingerpring distribution in the FOAF file for simple web-of-trust based key\circulating.\\What if we used FOAF and included the PGP key fingerprint(s) for identities?\This could mean a lot.  You include the PGP key fingerprints within the FOAF\file of your direct friends and then include a bloom filter of the PGP key\fingerprints of your entire whitelist (the source FOAF file would of course need\to be encrypted ).\\Your whitelist would be filled from the social network as your client\discovered new identit ...\\","Failed"
3.0,66.0,3.0,0.5333333333333333,"E-mail scam targets police chief Wiltshire Police warns about ""phishing"" after its fraud squad chief was targeted.",0.0,0.8333333333333334,"E-mail scam targets police chief Wiltshire Police apprised about ""phishing"" after its fraud squad chief was targeted.","Successful"
3.0,1.0,0.0,0.8,"Card fraud unit nets 36,000 cards In its first two years, the UK's dedicated card fraud unit, has recovered 36,000 stolen cards and 171 arrests - and estimates it saved 65m.",0.0,0.8,"Card fraud unit nets 36,000 cards In its first two years, the UK's dedicated card fraud unit, has recovered 36,000 stolen cards and 171 arrests - and estimates it saved 65m.","Skipped"
3.0,81.0,3.0,0.16666666666666663,"Group to Propose New High-Speed Wireless Format  LOS ANGELES (Reuters) - A group of technology companies  including Texas Instruments Inc. &lt;TXN.N&gt;, STMicroelectronics  &lt;STM.PA&gt; and Broadcom Corp. &lt;BRCM.O&gt;, on Thursday said they  will propose a new wireless networking standard up to 10 times  the speed of the current generation.",2.0,0.5333333333333333,"Group to Propose New High-Speed Wireless Format  LOS ANGELES (Reuters) - A group of technology companies  including Texas Equipments Inc. &lt;TXN.p&gt;, STMicroelectronics  &lt;STM.PA&gt; and Broadcom Corp. &lt;BRCM.O&gt;, on Thursday said they  will propose a new wireless networking standard up to 10 times  the speed of the current generation.","Successful"
3.0,864.0,3.0,0.033333333333333326,"Apple Launches Graphics Software, Video Bundle  LOS ANGELES (Reuters) - Apple Computer Inc.&lt;AAPL.O&gt; on  Tuesday began shipping a new program designed to let users  create real-time motion graphics and unveiled a discount  video-editing software bundle featuring its flagship Final Cut  Pro software.",3.0,0.30000000000000004,"Apple Launches Graphics Sw, Video Bundle  LOS ANGELES (Reuters) - Apple Teams Inc.&lt;AAPL.O&gt; on  Tuesday began shipping a new program fathered to let users  create real-time proposition graphics and unveiled a discount  video-editing software bundle featuring its flagship Final Cut  Pro software.","Failed"
3.0,176.0,3.0,0.23333333333333328,"Dutch Retailer Beats Apple to Local Download Market  AMSTERDAM (Reuters) - Free Record Shop, a Dutch music  retail chain, beat Apple Computer Inc. to market on Tuesday  with the launch of a new download service in Europe's latest  battleground for digital song services.",2.0,0.5333333333333333,"Dutch Retailer Beats Apple to Local Download Market  AMSTERDAM (Reuters) - Free Debrief Shop, a Dutch music  retail chain, beat Apple Computerised Inc. to market on Tuesday  with the launch of a new dump service in Europe's latest  tussle for digital song services.","Successful"
3.0,1.0,0.0,0.7,"Super ant colony hits Australia A giant 100km colony of ants  which has been discovered in Melbourne, Australia, could threaten local insect species.",0.0,0.7,"Super ant colony hits Australia A giant 100km colony of ants  which has been discovered in Melbourne, Australia, could threaten local insect species.","Skipped"
3.0,69.0,3.0,0.30000000000000004,"Socialites unite dolphin groups Dolphin groups, or ""pods"", rely on socialites to keep them from collapsing, scientists claim.",0.0,0.6333333333333333,"Socialites unite dolphin groups Dolphin groups, or ""pods"", rely on socialites to keep them from collapsing, scientists claiming.","Successful"
3.0,1.0,2.0,0.8,"Teenage T. rex's monster growth Tyrannosaurus rex achieved its massive size due to an enormous growth spurt during its adolescent years.",2.0,0.8,"Teenage T. rex's monster growth Tyrannosaurus rex achieved its massive size due to an enormous growth spurt during its adolescent years.","Skipped"
3.0,793.0,3.0,0.033333333333333326,"Scientists Discover Ganymede has a Lumpy Interior Jet Propulsion Lab -- Scientists have discovered irregular lumps beneath the icy surface of Jupiter's largest moon, Ganymede. These irregular masses may be rock formations, supported by Ganymede's icy shell for billions of years...",3.0,0.43333333333333335,"Clergymen Discover Ganymede has a Lumpy Interior Jet Propulsion Lab -- Geologists have find irregular lumps beneath the icing surface of Jupiter's largest moon, Ganymede. These irregular masses may be rock formations, supported by Ganymede's icy shell for billions of years...","Failed"
3.0,835.0,3.0,0.0,"Mars Rovers Relay Images Through Mars Express European Space Agency -- ESAs Mars Express has relayed pictures from one of NASA's Mars rovers for the first time, as part of a set of interplanetary networking demonstrations.     The demonstrations pave the way for future Mars missions to draw on joint interplanetary networking capabilities...",3.0,0.19999999999999996,"Mars Rovers Relay Images Through Mars Express European Space Agency -- ESAs Mar Express has relayed pictures from one of NASA's Mars rovers for the first dated, as part of a set of interplanetary networking demonstrations.     The demonstrations pave the way for future Mars missions to drew on joint interplanetary networking capabilities...","Failed"
3.0,122.0,3.0,0.33333333333333337,"Rocking the Cradle of Life When did life begin? One evidential clue stems from the fossil records in Western Australia, although whether these layered sediments are biological or chemical has spawned a spirited debate. Oxford researcher, Nicola McLoughlin, describes some of the issues in contention.",0.0,0.6,"Rocking the Cradle of Life When did life commencing? One evidential clue stems from the fossils records in Western Australia, although whether these layered sediments are biological or chemical has laid a spirited debate. Oxford researcher, Nicola McLoughlin, describes some of the issues in contention.","Successful"
3.0,30.0,3.0,0.30000000000000004,"Storage, servers bruise HP earnings update Earnings per share rise compared with a year ago, but company misses analysts' expectations by a long shot.",2.0,0.9,"Storage, servers bruise HORSEPOWER earnings update Earnings per share rise compared with a year ago, but company misses analysts' expectations by a long shot.","Successful"
3.0,32.0,3.0,0.5,"IBM to hire even more new workers By the end of the year, the computing giant plans to have its biggest headcount since 1991.",2.0,0.5666666666666667,"IBM to hire even more new workers By the end of the year, the computers giant plans to have its biggest headcount since 1991.","Successful"
3.0,53.0,3.0,0.43333333333333335,"Sun's Looking Glass Provides 3D View Developers get early code for new operating system 'skin' still being crafted.",0.0,0.6333333333333333,"Sun's Looking Drink Provides 3D View Developers get early code for new operating system 'skin' still being crafted.","Successful"
3.0,370.0,3.0,0.3666666666666667,"IBM Chips May Someday Heal Themselves New technology applies electrical fuses to help identify and repair faults.",3.0,0.5333333333333333,"IBM Creeps May Someday Heal Themselves New technology applies electrical fuses to aides identify and repair faults.","Failed"
3.0,1.0,2.0,0.6,"Some People Not Eligible to Get in on Google IPO Google has billed its IPO as a way for everyday people to get in on the process, denying Wall Street the usual stranglehold it's had on IPOs. Public bidding, a minimum of just five shares, an open process with 28 underwriters - all this pointed to a new level of public participation. But this isn't the case.",2.0,0.6,"Some People Not Eligible to Get in on Google IPO Google has billed its IPO as a way for everyday people to get in on the process, denying Wall Street the usual stranglehold it's had on IPOs. Public bidding, a minimum of just five shares, an open process with 28 underwriters - all this pointed to a new level of public participation. But this isn't the case.","Skipped"
3.0,1.0,2.0,0.9666666666666667,"Rivals Try to Turn Tables on Charles Schwab By MICHAEL LIEDTKE     SAN FRANCISCO (AP) -- With its low prices and iconoclastic attitude, discount stock broker Charles Schwab Corp. (SCH) represented an annoying stone in Wall Street's wing-tipped shoes for decades...",2.0,0.9666666666666667,"Rivals Try to Turn Tables on Charles Schwab By MICHAEL LIEDTKE     SAN FRANCISCO (AP) -- With its low prices and iconoclastic attitude, discount stock broker Charles Schwab Corp. (SCH) represented an annoying stone in Wall Street's wing-tipped shoes for decades...","Skipped"
3.0,117.0,3.0,0.33333333333333337,"News: Sluggish movement on power grid cyber security Industry cyber security standards fail to reach some of the most vulnerable components of the power grid.\",0.0,0.5666666666666667,"News: Sluggish movements on power grid onscreen security Mun cyber security guidelines fail to reach some of the most vulnerable components of the power grid.\","Successful"
1.0,1.0,0.0,0.6,"Giddy Phelps Touches Gold for First Time Michael Phelps won the gold medal in the 400 individual medley and set a world record in a time of 4 minutes 8.26 seconds.",0.0,0.6,"Giddy Phelps Touches Gold for First Time Michael Phelps won the gold medal in the 400 individual medley and set a world record in a time of 4 minutes 8.26 seconds.","Skipped"
1.0,1074.0,1.0,0.06666666666666665,"Tougher rules won't soften Law's game FOXBOROUGH -- Looking at his ridiculously developed upper body, with huge biceps and hardly an ounce of fat, it's easy to see why Ty Law, arguably the best cornerback in football, chooses physical play over finesse. That's not to imply that he's lacking a finesse component, because he can shut down his side of the field much as Deion Sanders ...",1.0,0.3666666666666667,"Tougher rules won't soften Law's game FOXBOROUGH -- Looking at his ridiculously developed upper body, with huge biceps and exclusively an ounce of fat, it's easy to see why Ty Law, arguably the best fullback in football, chooses physical play over finesse. That's not to insinuate that he's lacking a finesse component, because he can shut down his party of the domain much as Deion Sanders ...","Failed"
1.0,903.0,1.0,0.0,"Shoppach doesn't appear ready to hit the next level With the weeks dwindling until Jason Varitek enters free agency, the Red Sox continue to carefully monitor Kelly Shoppach , their catcher of the future, in his climb toward the majors. The Sox like most of what they have seen at Triple A Pawtucket from Shoppach, though it remains highly uncertain whether he can make the adjustments at the plate ...",1.0,0.3666666666666667,"Shoppach doesn't appear ready to hit the next level With the jours dwindling until Jason Varitek enters free agency, the Red Sox persisted to carefully monitor Kelly Shoppach , their bunt of the expectant, in his climb toward the majors. The Sox like most of what they have seen at Triple A Pawtucket from Shoppach, though it remains highly uncertain whether he can make the adjustments at the plate ...","Failed"
1.0,1013.0,1.0,0.033333333333333326,"Mighty Ortiz makes sure Sox can rest easy Just imagine what David Ortiz could do on a good night's rest. Ortiz spent the night before last with his baby boy, D'Angelo, who is barely 1 month old. He had planned on attending the Red Sox' Family Day at Fenway Park yesterday morning, but he had to sleep in. After all, Ortiz had a son at home, and he ...",1.0,0.5666666666666667,"Mighty Ortiz makes sure Sox can rest easy Just imagine what David Ortiz could do on a good night's rest. Ortiz spent the night before last with his baby boy, D'Angelo, who is barely 1 month old. He had forecast on attending the Red Sox' Conjugal Day at Slough Parking fridays morning, but he had to sleep in. After all, Ortiz had a son at home, and he ...","Failed"
1.0,41.0,1.0,0.4,"They've caught his eye In  quot;helping themselves, quot; Ricky Bryant, Chas Gessner, Michael Jennings, and David Patten did nothing Friday night to make Bill Belichick's decision on what to do with his receivers any easier.",0.0,0.6,"They've caught his eye In  quot;helping themselves, quot; Ricky Bryant, Chas Gessner, Michael Jennings, and David Patten did nothing Friday night to make Bill Belichick's decision on what to do with his receiver any easier.","Successful"
1.0,180.0,1.0,0.1333333333333333,"Indians Mount Charge The Cleveland Indians pulled within one game of the AL Central lead by beating the Minnesota Twins, 7-1, Saturday night with home runs by Travis Hafner and Victor Martinez.",3.0,0.6,"Indians Mount Upload The Cleveland Indians pulled within one jeu of the AL Central lead by beating the Minnesota Twins, 7-1, Saturday night with home administering by Travis Hafner and Victor Martinez.","Successful"
0.0,924.0,0.0,0.033333333333333326,"Sister of man who died in Vancouver police custody slams chief (Canadian Press) Canadian Press - VANCOUVER (CP) - The sister of a man who died after a violent confrontation with police has demanded the city's chief constable resign for defending the officer involved.",0.0,0.6,"Sister of guy who died in Vancouver police custody slams chairperson (Canadian Press) Canadian Press - CANADIENS (CP) - The sister of a humans who bereavement after a violent confrontation with police has demanded the city's chief nypd resign for defending the officer involved.","Failed"
0.0,801.0,0.0,0.1333333333333333,"Man Sought  #36;50M From McGreevey, Aides Say (AP) AP - The man who claims Gov. James E. McGreevey sexually harassed him was pushing for a cash settlement of up to  #36;50 million before the governor decided to announce that he was gay and had an extramarital affair, sources told The Associated Press.",0.0,0.4,"Man Sought  #36;50M From McGreevey, Aides Declare (AP) AP - The man who claims Gov. James E. McGreevey sexually manhandled him was pushing for a cash settlement of up to  #36;50 million before the governor decided to announced that he was heterosexuals and had an extramarital affair, sources told The Associated Press.","Failed"
0.0,839.0,0.0,0.0,"Explosions Echo Throughout Najaf NAJAF, Iraq - Explosions and gunfire rattled through the city of Najaf as U.S. troops in armored vehicles and tanks rolled back into the streets here Sunday, a day after the collapse of talks - and with them a temporary cease-fire - intended to end the fighting in this holy city...",0.0,0.4,"Explosions Echo Throughout Najaf NAJAF, Iraq - Explosions and gunfire shakes through the city of Najaf as U.S. troops in shield trucking and tanks rolled back into the streets here Saturday, a day after the slump of talks - and with them a ephemeral cease-fire - intended to expire the fighting in this holy city...","Failed"
0.0,967.0,0.0,0.06666666666666665,"Frail Pope Celebrates Mass at Lourdes LOURDES, France - A frail Pope John Paul II, breathing heavily and gasping at times, celebrated an open-air Mass on Sunday for several hundred thousand pilgrims, many in wheelchairs, at a shrine to the Virgin Mary that is associated with miraculous cures.    At one point he said ""help me"" in Polish while struggling through his homily in French...",2.0,0.6666666666666667,"Frail Dady Memorial Mass at Hefty LOURDES, France - A frail Pope John Palo II, breathing heavily and gasping at times, celebrated an open-air Mass on Sunday for several hundred thousand pilgrims, different in wheelchairs, at a shrine to the Virgin Mariam that is subsidiary with miraculous cures.    At one point he said ""help me"" in Polish while trying through his homily in French...","Successful"
0.0,122.0,0.0,0.30000000000000004,"Venezuela Prepares for Chavez Recall Vote Supporters and rivals warn of possible fraud; government says Chavez's defeat could produce turmoil in world oil market.",2.0,0.5333333333333333,"Venezuela Prepares for Chavez Recall Vote Supporters and rivals warn of possible fraud; government says Chavez's defeat could produce convulsion in globe oil market.","Successful"
0.0,1.0,2.0,0.6333333333333333,"1994 Law Designed to Preserve Guard Jobs (AP) AP - A 1994 law strengthened job protections for National Guard and Reserve troops called to active duty. Here are major provisions of the Uniformed Services Employment and Reemployment Rights Act (USERRA).",2.0,0.6333333333333333,"1994 Law Designed to Preserve Guard Jobs (AP) AP - A 1994 law strengthened job protections for National Guard and Reserve troops called to active duty. Here are major provisions of the Uniformed Services Employment and Reemployment Rights Act (USERRA).","Skipped"
0.0,790.0,0.0,0.0,"Iran Warns Its Missiles Can Hit Anywhere in Israel  TEHRAN (Reuters) - A senior Iranian military official said  Sunday Israel and the United States would not dare attack Iran  since it could strike back anywhere in Israel with its latest  missiles, news agencies reported.",0.0,0.5,"Iran Precautionary Its Bombs Can Hit Anywhere in Erez  TEHRAN (Reuters) - A senior Iranian military servers said  Sunday Israel and the Uni Sate would not dare attack Iran  since it could strike back anywhere in Israel with its further  missiles, news agencies reported.","Failed"
0.0,452.0,0.0,0.0,"Afghan Army Dispatched to Calm Violence KABUL, Afghanistan - Government troops intervened in Afghanistan's latest outbreak of deadly fighting between warlords, flying from the capital to the far west on U.S. and NATO airplanes to retake an air base contested in the violence, officials said Sunday...",2.0,0.6,"Afghan Army Emissaries to Calm Violence KABUL, Afghanistan - Government contingent intervened in Afghanistan's latest outbreak of deathly battlefield between warlords, airline from the investing to the far west on U.S. and NATO airplanes to retake an air database questionable in the violence, officials said Sunday...","Successful"
