"ground_truth_output","num_queries","original_output","original_score","original_text","perturbed_output","perturbed_score","perturbed_text","result_type"
2.0,779.0,2.0,0.06666666666666665,"Kmart Swings to Profit in 2Q; Stock Surges (AP) AP - Shares of Kmart Holding Corp. surged 17 percent Monday after the discount retailer reported a profit for the second quarter and said chairman and majority owner Edward Lampert is now free to invest the company's  #36;2.6 billion in surplus cash.",2.0,0.2666666666666667,"Kmart Swings to Profit in 2Q; Stock Surges (AP) AP - Shares of Kmart Holding Corp. climbing 17 percent Monday after the discount retailer reported a profit for the second quarter and said chairman and majority owner Edward Lampert is now free to invest the company's  #36;2.6 billion in surplus cash.","Failed"
0.0,74.0,0.0,0.19999999999999996,"Fischer's Fiancee: Marriage Plans Genuine (AP) AP - Former chess champion Bobby Fischer's announcement thathe is engaged to a Japanese woman could win him sympathy among Japanese officials and help him avoid deportation to the United States, his fiancee and one of his supporters said Tuesday.",1.0,0.5666666666666667,"Fischer's Fiancee: Marriage Plans Genuine (AP) AP - Former chess champion Bobby Fischer's announcement thathe is engaged to a Japanese woman could win him sympathy among Japanese officials and help him avoid deportation to the United States, his keri and one of his supporters said Tuesday.","Successful"
0.0,1.0,1.0,0.9,"U.S. Misses Cut in Olympic 100 Free ATHENS, Greece - Top American sprinters Jason Lezak and Ian Crocker missed the cut in the Olympic 100-meter freestyle preliminaries Tuesday, a stunning blow for a country that had always done well in the event.    Pieter van den Hoogenband of the Netherlands and Australian Ian Thorpe advanced to the evening semifinal a day after dueling teenager Michael Phelps in the 200 freestyle, won by Thorpe...",1.0,0.9,"U.S. Misses Cut in Olympic 100 Free ATHENS, Greece - Top American sprinters Jason Lezak and Ian Crocker missed the cut in the Olympic 100-meter freestyle preliminaries Tuesday, a stunning blow for a country that had always done well in the event.    Pieter van den Hoogenband of the Netherlands and Australian Ian Thorpe advanced to the evening semifinal a day after dueling teenager Michael Phelps in the 200 freestyle, won by Thorpe...","Skipped"
3.0,1.0,2.0,0.6333333333333333,"Consumers Would Pay In Phone Proposal A proposal backed by a coalition of telephone carriers would cut billions of dollars in fees owed by long-distance companies to regional phone giants but would allow the regional companies to make up some of the difference by raising monthly phone bills for millions of consumers. &lt;FONT face=""verdana,MS Sans Serif,arial,helvetica"" size=""-2""\ color=""#666666""&gt;&lt;B&gt;-The Washington Post&lt;/B&gt;&lt;/FONT&gt;",2.0,0.6333333333333333,"Consumers Would Pay In Phone Proposal A proposal backed by a coalition of telephone carriers would cut billions of dollars in fees owed by long-distance companies to regional phone giants but would allow the regional companies to make up some of the difference by raising monthly phone bills for millions of consumers. &lt;FONT face=""verdana,MS Sans Serif,arial,helvetica"" size=""-2""\ color=""#666666""&gt;&lt;B&gt;-The Washington Post&lt;/B&gt;&lt;/FONT&gt;","Skipped"
0.0,490.0,0.0,0.0,"U.S. Brokers Cease-fire in Western Afghanistan  KABUL (Reuters) - The United States has brokered a  cease-fire between a renegade Afghan militia leader and the  embattled governor of the western province of Herat,  Washington's envoy to Kabul said Tuesday.",0.0,0.09999999999999998,"U.S. Brokers Cease-fire in Western Afghanistan  KABUL (Reuters) - The United States has brokered a  cease-fire between a renegade Afghan militia leader and the  embattled governor of the western county of Herat,  Washington's envoy to Baghdad said Tuesday.","Failed"
2.0,308.0,2.0,0.09999999999999998,"Sneaky Credit Card Tactics Keep an eye on your credit card issuers -- they may be about to raise your rates.",2.0,0.4666666666666667,"Sneaky Credence Letter Tactics Keep an eye on your lending card issuers -- they may be about to heighten your rates.","Failed"
3.0,177.0,3.0,0.3666666666666667,"Intel Delays Launch of Projection TV Chip In another product postponement, semiconductor giant Intel Corp. said it won't be offering a chip for projection TVs by the end of 2004 as it had announced earlier this year.",2.0,0.5333333333333333,"Intel Delays Launch of Foresee TV Die In another commodity postponement, semiconductor giant Intel Corp. said it won't be offering a chip for projection TVs by the end of 2004 as it had announced earlier this year.","Successful"
2.0,678.0,2.0,0.033333333333333326,"Fund pessimism grows NEW YORK (CNN/Money) - Money managers are growing more pessimistic about the economy, corporate profits and US stock market returns, according to a monthly survey by Merrill Lynch released Tuesday. ",2.0,0.2666666666666667,"Cash pessimism grows NEW YORK (CNN/Money) - Money administering are growing more despondent about the economy, corporate profits and US stock trade returns, according to a monthly survey by Merrill Lynch released Hier. ","Failed"
1.0,1.0,0.0,0.5666666666666667,"Kederis proclaims innocence Olympic champion Kostas Kederis today left hospital ahead of his date with IOC inquisitors claiming his innocence and vowing:  quot;After the crucifixion comes the resurrection. quot; ...",0.0,0.5666666666666667,"Kederis proclaims innocence Olympic champion Kostas Kederis today left hospital ahead of his date with IOC inquisitors claiming his innocence and vowing:  quot;After the crucifixion comes the resurrection. quot; ...","Skipped"
1.0,112.0,1.0,0.09999999999999998,"Eriksson doesn #39;t feel any extra pressure following scandal NEWCASTLE, England (AP) - England coach Sven-Goran Eriksson said Tuesday he isn #39;t under any extra pressure in the aftermath of a scandal that damaged the Football Association #39;s reputation. ",0.0,0.6333333333333333,"Carlson doesn #39;t feel any extra pressure following scandal NEWCASTLE, England (AP) - England coach Sven-Goran Eriksson said Tuesday he isn #39;t under any ancillary pressure in the aftermath of a scandals that damaged the Ballon Association #39;s reputation. ","Successful"
1.0,567.0,1.0,0.06666666666666665,"Injured Heskey to miss England friendly NEWCASTLE, England (AP) - Striker Emile Heskey has pulled out of the England squad ahead of Wednesday #39;s friendly against Ukraine because of a tight hamstring, the Football Association said Tuesday. ",1.0,0.5,"Casualty Heskey to miss England friendly NOTTINGHAM, England (AP) - Striker Emile Heskey has recanted out of the England patrolling ahead of Wednesday #39;s friendly against Ukraine because of a tight hammy, the Football Association said Tuesday. ","Failed"
2.0,944.0,2.0,0.0,"Staples Profit Up, to Enter China Market  NEW YORK (Reuters) - Staples Inc. &lt;A HREF=""http://www.investor.reuters.com/FullQuote.aspx?ticker=SPLS.O target=/stocks/quickinfo/fullquote""&gt;SPLS.O&lt;/A&gt;, the top U.S.  office products retailer, on Tuesday reported a 39 percent jump  in quarterly profit, raised its full-year forecast and said it  plans to enter the fast-growing Chinese market, sending its  shares higher.",2.0,0.33333333333333337,"Staples Advantage Up, to Enter China Market  NEW YORK (Reuters) - Staples Inc. &lt;A HREF=""http://www.investor.reuters.com/FullQuote.aspx?ticker=SPLS.O target=/stocks/quickinfo/fullquote""&gt;SPLS.O&lt;/A&gt;, the top U.S.  office products retailer, on Tuesday reported a 39 percent jump  in quarterly profit, raised its full-year forecast and said it  plans to enter the fast-growing Chinese market, forwarding its  currency higher.","Failed"
0.0,842.0,0.0,0.0,"Delegation Is Delayed Before Reaching Najaf AGHDAD, Iraq, Aug. 17  A delegation of Iraqis was delayed for security reasons today but still intended to visit Najaf to try to convince a rebellious Shiite cleric and his militia to evacuate a shrine in the holy city and end ...",0.0,0.30000000000000004,"Tasks Is Delayed Before Reaching Najaf AGHDAD, Iraq, Aug. 17  A delegation of Iraqis was delayed for assure reasons today but still intended to visit Najaf to experiments to convince a rebellious Shiite seminarian and his posey to evacuate a shrine in the holy city and end ...","Failed"
2.0,820.0,2.0,0.06666666666666665,"Consumer Prices Down, Industry Output Up  WASHINGTON (Reuters) - U.S. consumer prices dropped in July  for the first time in eight months as a sharp run up in energy  costs reversed, the government said in a report that suggested  a slow rate of interest rate hikes is likely.",2.0,0.23333333333333328,"Consumer Prices Down, Industry Output Up  WASHINGTON (Reuters) - U.S. consumer prices dropped in July  for the first time in six months as a sharp run up in energy  costs overturned, the gov said in a report that suggested  a slow rate of interest rate hikes is likely.","Failed"
