"ground_truth_output","num_queries","original_output","original_score","original_text","perturbed_output","perturbed_score","perturbed_text","result_type"
1.0,606.0,1.0,0.0,"Johnson Helps D-Backs End Nine-Game Slide (AP) AP - Randy Johnson took a four-hitter into the ninth inning to help the Arizona Diamondbacks end a nine-game losing streak Sunday, beating Steve Trachsel and the New York Mets 2-0.",1.0,0.16666666666666663,"Johnson Contribution D-Backs End Nine-Game Slide (AP) HA - Randy Johnson took a four-hitter into the ninth inning to help the Arizona Diamondbacks end a nine-game losing spate Sunday, beating Steve Trachsel and the New York Mets 2-0.","Failed"
2.0,157.0,2.0,0.09999999999999998,"Retailers Vie for Back-To-School Buyers (Reuters) Reuters - Apparel retailers are hoping their\back-to-school fashions will make the grade among\style-conscious teens and young adults this fall, but it could\be a tough sell, with students and parents keeping a tighter\hold on their wallets.",0.0,0.5666666666666667,"Retailers Vie for Back-To-School Buyers (Reuters) Reuters - Yee retailers are hoping their\back-to-school fashions will make the grade among\style-conscious teens and junior adults this fall, but it could\be a violent sell, with students and parents keeping a tighter\hold on their sac.","Successful"
0.0,200.0,0.0,0.4,"Politics an Afterthought Amid Hurricane (AP) AP - If Hurricane Charley had struck three years ago, President Bush's tour through the wreckage of this coastal city would have been just the sort of post-disaster visit that other presidents have made to the scenes of storms, earthquakes, floods and fires.",1.0,0.7,"Politics an Afterthought Amid Hurricane (AP) AP - If Hurricane Charley had struck three ages ago, President Bush's tour through the ruin of this coastal city would have been just the sort of post-disaster visit that other presidents have submitted to the photograph of storms, earthquakes, avalanche and fires.","Successful"
3.0,282.0,3.0,0.3666666666666667,"Spam suspension hits Sohu.com shares (FT.com) FT.com - Shares in Sohu.com, a leading US-listed Chinese internet portal, fell more than 10 per cent on Friday after China's biggest mobile phone network operator imposed a one-year suspension on its multimedia messaging services because of customers being sent spam.",2.0,0.5333333333333333,"Spam respite rips Sohu.com shares (FT.com) FT.com - Shares in Sohu.com, a momentous US-listed Chinese internet portal, fell more than 10 per cent on Friday after China's biggest mobile phone network operator imposed a one-year suspension on its multimedia messaging services because of customers being sent spam.","Successful"
1.0,637.0,1.0,0.033333333333333326,"Erstad's Double Lifts Angels to Win (AP) AP - Darin Erstad doubled in the go-ahead run in the eighth inning, lifting the Anaheim Angels to a 3-2 victory over the Detroit Tigers on Sunday. The win pulled Anaheim within a percentage point of Boston and Texas in the AL wild-card race.",1.0,0.2666666666666667,"Erstad's Double Hanger Angels to Win (AP) AP - Darin Erstad doubled in the go-ahead run in the eighth inning, lifting the Modesto Angels to a 3-2 victory over the Detroit Tigers on Sunday. The win pulled Anaheim within a percentage point of Boston and Texas in the AL wild-card race.","Failed"
1.0,534.0,1.0,0.0,"Drew Out of Braves' Lineup After Injury (AP) AP - Outfielder J.D. Drew missed the Atlanta Braves' game against the St. Louis Cardinals on Sunday night with a sore right quadriceps.",1.0,0.4,"Drew Out of Braves' Forming After Harmed (AP) AP - Outfielder J.D. Request missed the Atlanta Braves' toy against the St. Louis Cardinals on Weekends night with a sore right quadriceps.","Failed"
0.0,623.0,0.0,0.1333333333333333,"Venezuelans Flood Polls, Voting Extended  CARACAS, Venezuela (Reuters) - Venezuelans voted in huge  numbers on Sunday in a historic referendum on whether to recall  left-wing President Hugo Chavez and electoral authorities  prolonged voting well into the night.",0.0,0.30000000000000004,"Venezuelans Flood Polls, Voting Expanding  CARACAS, Chavez (Reuters) - Venezuelans voted in huge  numbers on Sunday in a historic election on whether to recall  left-wing President Hugo Chavez and electoral authorities  prolonged voting well into the dark.","Failed"
3.0,63.0,3.0,0.30000000000000004,"Dell Exits Low-End China Consumer PC Market  HONG KONG (Reuters) - Dell Inc. &lt;DELL.O&gt;, the world's  largest PC maker, said on Monday it has left the low-end  consumer PC market in China and cut its overall growth target  for the country this year due to stiff competition in the  segment.",2.0,0.6,"Del Exits Low-End China Consumer PC Market  HONG KONG (Reuters) - Dell Inc. &lt;DELL.O&gt;, the world's  largest PC maker, said on Monday it has left the low-end  consumer ACCOUTREMENTS market in China and cut its overall growth target  for the country this year due to stiff competition in the  segment.","Successful"
0.0,379.0,0.0,0.06666666666666665,"China Says Taiwan Spy Also Operated in U.S. - Media  BEIJING (Reuters) - Beijing on Monday accused a  Chinese-American arrested for spying for Taiwan of building an  espionage network in the United States, and said he could go on  trial very soon.",3.0,0.5666666666666667,"China Denotes Taiwan Spy Also Operated in U.r. - Media  BEIJING (Reuters) - Beijing on Monday culpability a  Chinese-American arrested for bothering for Taiwan of building an  surreptitiously network in the United States, and explaining he could go on  trial very soon.","Successful"
1.0,287.0,1.0,0.19999999999999996,"Another Major Non-Factor Another major, another disappointment for Tiger Woods, the No. 1 ranked player in the world who has not won a major championship since his triumph at the 2002 U.S. Open.",0.0,0.5333333333333333,"Another Major Non-Factor Another notable, another antipathy for Tiger Woods, the Nada. 1 ranked player in the world who has not won a major championship since his triumph at the 2002 U.S. Inaugurated.","Successful"
0.0,597.0,0.0,0.33333333333333337,"US fighter squadron to be deployed in South Korea next month (AFP) AFP - A squadron of US Air Force F-15E fighters based in Alaska will fly to South Korea next month for temporary deployment aimed at enhancing US firepower on the Korean peninsula, US authorities said.",2.0,0.5666666666666667,"US fighter squadron to be deployed in South Korea next month (AFP) AFP - A squadron of VS Air Kraft F-15E fighting based in Alaska will fly to South Korea next month for temporary deployment aimed at enhancing US fire on the Rok peninsula, US authorities said.","Successful"
1.0,703.0,1.0,0.0,"Johnson Back to His Best as D-Backs End Streak  NEW YORK (Reuters) - Randy Johnson struck out 14 batters in  8 1/3 innings to help the Arizona Diamondbacks end a nine-game  losing streak with a 2-0 win over the host New York Mets in the  National League Sunday.",1.0,0.23333333333333328,"Johnson Back to His Best as D-Backs End Streak  NEW YORK (Reuters) - Mikey Johnson struck out 14 batters in  8 1/3 innings to help the Arizona Diamondbacks end a nine-game  losing streak with a 2-0 win over the host New York Dodger in the  Country League Sunday.","Failed"
0.0,583.0,0.0,0.06666666666666665,"Restive Maldives eases curfew after rounding up dissidents (AFP) AFP - A curfew in the capital of the Maldives was eased but parliament sessions were put off indefinitely and emergency rule continued following last week's riots, officials and residents said.",0.0,0.4666666666666667,"Restive Maldives eases curfew after rounding up dissidents (AFP) AFP - A confining in the investor of the Maldives was eased but parliament sessions were put off consistently and contingency bylaws constants following last week's riots, officials and residents said.","Failed"
3.0,34.0,3.0,0.5,"Vodafone hires Citi for Cesky bid (TheDeal.com) TheDeal.com - The U.K. mobile giant wants to find a way to disentagle the Czech wireless and fixed-line businesses.",2.0,0.6333333333333333,"Vodafone hires Citi for Cesky bid (TheDeal.com) TheDeal.com - The U.K. mobiles giant wants to find a way to disentagle the Czech wireless and fixed-line businesses.","Successful"
2.0,762.0,2.0,0.09999999999999998,"Dollar Briefly Hits 4-Wk Low Vs Euro  LONDON (Reuters) - The dollar dipped to a four-week low  against the euro on Monday before rising slightly on  profit-taking, but steep oil prices and weak U.S. data  continued to fan worries about the health of the world's  largest economy.",2.0,0.43333333333333335,"Dollar Briefly Hits 4-Wk Low Vs Euro  LONDON (Reuters) - The buck dipped to a four-week low  against the euro on Thursday before rising slightly on  profit-taking, but steep oil prices and weak U.S. data  continued to fan worries about the health of the world's  meanest economy.","Failed"
3.0,1.0,0.0,0.9333333333333333,"Promoting a Shared Vision As Michael Kaleko kept running into people who were getting older and having more vision problems, he realized he could do something about it.",0.0,0.9333333333333333,"Promoting a Shared Vision As Michael Kaleko kept running into people who were getting older and having more vision problems, he realized he could do something about it.","Skipped"
0.0,1.0,2.0,0.9666666666666667,"India's Tata expands regional footprint via NatSteel buyout (AFP) AFP - India's Tata Iron and Steel Company Ltd. took a strategic step to expand its Asian footprint with the announcement it will buy the Asia-Pacific steel operations of Singapore's NatSteel Ltd.",2.0,0.9666666666666667,"India's Tata expands regional footprint via NatSteel buyout (AFP) AFP - India's Tata Iron and Steel Company Ltd. took a strategic step to expand its Asian footprint with the announcement it will buy the Asia-Pacific steel operations of Singapore's NatSteel Ltd.","Skipped"
0.0,641.0,0.0,0.0,"Delegates Urge Cleric to Pull Out of Najaf BAGHDAD, Iraq - Delegates at Iraq's National Conference called on radical Shiite cleric Muqtada al-Sadr to abandon his uprising against U.S. and Iraqi troops and pull his fighters out of a holy shrine in Najaf...",0.0,0.033333333333333326,"Commissioners Urge Cleric to Pull Out of Najaf BAGHDAD, Iraq - Delegates at Iraq's National Conference called on radical Shiite cleric Muqtada al-Sadr to abandon his uprising against U.S. and Iraqi troops and pull his fighters out of a holy shrine in Najaf...","Failed"
2.0,632.0,2.0,0.033333333333333326,"Treasuries Slip as Stocks Rally  NEW YORK (Reuters) - U.S. Treasury debt prices slipped on  Monday, though traders characterized the move as profit-taking  rather than any fundamental change in sentiment.",2.0,0.3666666666666667,"Exchequer Slip as Stocks Climbs  NEW YORK (Reuters) - U.S. Treasury debt cost slipped on  Monday, albeit traders characterized the move as profit-taking  modestly than any fundamental change in sentiment.","Failed"
2.0,632.0,2.0,0.09999999999999998,"Dollar Rises Vs Euro on Asset Flows Data  NEW YORK (Reuters) - The dollar extended gains against the  euro on Monday after a report on flows into U.S. assets showed  enough of a rise in foreign investments to offset the current  account gap for the month.",2.0,0.33333333333333337,"Dollar Rises Five Euro on Asset Flows Data  NEW YORK (Reuters) - The dollar extended gains against the  euro on Monday after a report on flows into U.S. assets showed  enough of a risen in foreign placements to offset the updated  account gap for the month.","Failed"
1.0,651.0,1.0,0.033333333333333326,"Sutton Adds Haas, Cink to Ryder Cup Team  MILWAUKEE (Sports Network) - U.S. Ryder Cup captain Hal  Sutton finalized his team on Monday when he announced the  selections of Jay Haas and Stewart Cink as his captain's picks.",1.0,0.7,"Melton Adds Haas, Cink to Ryder Taza Pc  BALTIMORE (Athletes Network) - U.S. Ryder Cup captain Hal  Stratford finalized his team on Monday when he released the  elected of Jay Haa and Stewart Cink as his captain's picks.","Failed"
1.0,146.0,1.0,0.033333333333333326,"Haas and Cink Selected for Ryder Cup Team Jay Haas joined Stewart Cink as the two captain's picks for a U.S. team that will try to regain the cup from Europe next month.",3.0,0.6333333333333333,"Haas and Cink Take for Ryder Glassware Team Jay Haas joined Stewart Cink as the two captain's picks for a U.S. computer that will try to regain the cup from Europe next month.","Successful"
1.0,766.0,1.0,0.033333333333333326,"Natalie Coughlin Wins 100M Backstroke (AP) AP - American Natalie Coughlin won Olympic gold in the 100-meter backstroke Monday night. Coughlin, the only woman ever to swim under 1 minute in the event, finished first in 1 minute, 0.37 seconds. Kirsty Coventry of Zimbabwe, who swims at Auburn University in Alabama, earned the silver in 1:00.50. Laure Manaudou of France took bronze in 1:00.88.",1.0,0.2666666666666667,"Natalie Coughlin Wins 100M Backstroke (AP) AP - American Natalie Coughlin won Olympic gold in the 100-meter backstroke Monday night. Shanahan, the only woman ever to swim under 1 minute in the event, fini first in 1 minute, 0.37 seconds. Kirsty Coventry of Zimbabwe, who swims at Sparkly Scholarly in Alabama, earned the silver in 1:00.50. Laure Manaudou of France decided bronze in 1:00.88.","Failed"
3.0,370.0,3.0,0.06666666666666665,"Oracle Overhauls Sales-Side Apps for CRM Suite (NewsFactor) NewsFactor - Oracle (Nasdaq: ORCL) has revamped its sales-side CRM applications in version 11i.10 of its sales, marketing, partner relationship management and e-commerce application.",3.0,0.4,"Oracle Overhauls Sales-Side Requisitions for CRM Suite (NewsFactor) NewsFactor - Oracle (Nasdaq: ORCL) owns revamped its sales-side CRM applications in stepping 11i.10 of its sales, marketing, partner bonds management and e-commerce enquired.","Failed"
0.0,248.0,0.0,0.0,"UN launches 210-million-dollar appeal for flood-hit Bangladesh (AFP) AFP - The United Nations launched an appeal here for 210 million dollars to help flood victims facing ""grave"" food shortages after two-thirds of Bangladesh was submerged, destroying crops and killing more than 700 people.",3.0,0.6666666666666667,"UN startup 210-million-dollar appeal for flood-hit Meng (AFP) AFP - The United Nations commenced an appeal here for 210 million dollars to help flood victims facing ""grave"" food flaw after two-thirds of Kolkata was submerged, destroying crops and killing more than 700 people.","Successful"
3.0,302.0,3.0,0.19999999999999996,"Indian state rolls out wireless broadband Government in South Indian state of Kerala sets up wireless kiosks as part of initiative to bridge digital divide.",3.0,0.4666666666666667,"Indian state rolls out wireless broadband Government in South Indian state of Kerala sets up wireless kiosks as fraction of initiative to deck digital disparity.","Failed"
0.0,65.0,0.0,0.43333333333333335,"Hurricane Survivors Wait for Water, Gas PUNTA GORDA, Fla. - Urban rescue teams, insurance adjusters and National Guard troops scattered across Florida Monday to help victims of Hurricane Charley and deliver water and other supplies to thousands of people left homeless...",2.0,0.5666666666666667,"Hurricane Survivors Wait for Water, Gas PUNTA GORDA, Fla. - Urban rescue teams, insurance adjusters and National Guard troops scattered across Ornamental Monday to help victims of Hurricane Charley and deliver water and other goods to thousands of people left homeless...","Successful"
0.0,296.0,0.0,0.23333333333333328,"Jackson Squares Off With Prosecutor SANTA MARIA, Calif. - Fans of Michael Jackson erupted in cheers Monday as the pop star emerged from a double-decker tour bus and went into court for a showdown with the prosecutor who has pursued him for years on child molestation charges...",1.0,0.6,"Brandon Squares Off With Prosecutor SANTA MARIA, Calif. - Fans of Michael Jackson erupted in bye Monday as the poppa star emerged from a double-decker tour bus and went into court for a showdown with the prosecutor who has pursued him for years on child molestation charges...","Successful"
1.0,431.0,1.0,0.06666666666666665,"Bobcats Trade Drobnjak to Hawks for Pick (AP) AP - The Charlotte Bobcats traded center Predrag Drobnjak to the Atlanta Hawks on Monday for a second round pick in the 2005 NBA draft.",1.0,0.23333333333333328,"Bobcats Trade Drobnjak to Hawks for Pick (HAS) AP - The Charlotte Bobcats marketed center Predrag Drobnjak to the Atlanta Hawks on Mons for a second cycles pick in the 2005 NBA draft.","Failed"
0.0,603.0,0.0,0.06666666666666665,"Suspect charged in abduction, sexual assault of 11-year-old girl (Canadian Press) Canadian Press - LANGLEY, B.C. (CP) - Police have arrested a man in the kidnapping and sexual assault of an 11-year-old girl that frightened this suburban Vancouver community last week.",1.0,0.7666666666666666,"Suspect burden in abduction, sexual offense of 11-year-old girl (Canadian Press) Canadian Press - LANGLEY, B.C. (CP) - Patrolman have arrested a man in the abstraction and sexual assault of an 11-year-old babe that spooked this suburban Canadiens collective last week.","Successful"
3.0,141.0,3.0,0.19999999999999996,"China's Red Flag Linux to focus on enterprise Red Flag Software Co., the company behind China's leading Linux client distribution, plans to focus more on its server operating system and enterprise customers, the company's acting president said.",2.0,0.6,"China's Red Flag Foss to focus on enterprise Red Flag Sw Co., the company behind China's leading Linux client distribution, plans to focus more on its waitress operating system and enterprise customers, the company's acting presiding alluded.","Successful"
3.0,1145.0,3.0,0.033333333333333326,"AOL Properties Sign Girafa For Thumbnail Search Images AOL Properties Sign Girafa For Thumbnail Search Images\\Girafa.com Inc. announced today that the CompuServe, Netscape, AIM and ICQ properties of America Online, Inc., have signed an agreement with Girafa to use Girafa's thumbnail search images as an integrated part of their search results.\\Using Girafa's thumbnail search service, search users can ...",3.0,0.4,"AOL Properties Sign Girafa For Thumbnail Investigated Images AOL Properties Sign Girafa For Thumbnail Searches Images\\Girafa.com Inc. announced today that the CompuServe, Netscape, AIM and ICQ properties of America Online, Inc., have signed an agreement with Girafa to use Girafa's thumbnail locating picture as an integrated part of their search results.\\Using Girafa's thumbnail search service, search users can ...","Failed"
3.0,402.0,3.0,0.09999999999999998,"Cassini Spies Two Little Saturn Moons (AP) AP - NASA's Cassini spacecraft has spied two new little moons around satellite-rich Saturn, the space agency said Monday.",3.0,0.4,"Cassini Incognito Two Little Saturn Moons (AP) AP - NASA's Cassini spacecraft has spied two new little moons around satellite-rich Saturn, the space agency said Monday.","Failed"
0.0,41.0,0.0,0.09999999999999998,"On front line of AIDS in Russia An industrial city northwest of Moscow struggles as AIDS hits a broader population.",2.0,0.5333333333333333,"On front line of AIDS in Ruble An industrial city ouest of Moscow struggles as AIDS hits a broader population.","Successful"
3.0,94.0,3.0,0.33333333333333337,"Nobel Laureate Decries Stem Cell Limits (AP) AP - A Nobel laureate in medicine said Monday the Bush administration's limits on funding for embryonic stem cell research effectively have stopped the clock on American scientists' efforts to develop treatments for a host of chronic, debilitating diseases.",0.0,0.5666666666666667,"Nobel Laureate Decries Stem Cell Limits (AP) AP - A Nobel laureate in medicine said Monday the Bush administration's limits on funding for embryonic stem cell searching effectively have stopped the clock on American scientists' efforts to develop treatments for a host of chronic, debilitating diseases.","Successful"
1.0,68.0,1.0,0.4666666666666667,"Jury Can Hear of Kobe Accuser's Sex Life (AP) AP - Prosecutors suffered another setback Monday in the Kobe Bryant sexual assault case, losing a last-ditch attempt to keep the NBA star's lawyers from telling jurors about the alleged victim's sex life.",0.0,0.5666666666666667,"Jury Can Hear of Kobe Accuser's Sex Life (AP) AP - Prosecutors suffered another setback Monday in the Kobe Bryant sexual assault case, missing a last-ditch attempt to keep the NBA star's lawyers from telling jurors about the alleged victim's sex life.","Successful"
0.0,740.0,0.0,0.0,"North Korea Talks Still On, China Tells Downer (Reuters) Reuters - China has said no date has been set for\working-level talks on the North Korean nuclear crisis and gave\no indication that the meeting has been canceled, Australian\Foreign Minister Alexander Downer said on Tuesday.",0.0,0.5,"North Korea Talks Still On, China Tells Downer (Reuters) Reuters - China is said no date possesses been configure for\working-level talks on the North Korean nuclear recession and gave\no indication that the meeting has been canceled, Australian\Foreign Minister Alexander Downer highlighted on Tuesday.","Failed"
1.0,119.0,1.0,0.4666666666666667,"Griffin to Anchor D-Line The Redskins expect huge things from 300-pound Cornelius Griffin, who was signed to aid the team's weakest unit - the defensive line.",0.0,0.7,"Griffin to Anchor D-Line The Texans expect huge dot from 300-pound Cornelius Griffin, who was signed to aid the team's weakest unit - the defensive concord.","Successful"
0.0,740.0,0.0,0.033333333333333326,"Last American defector in North Korea agrees to tell story (AFP) AFP - The last surviving American defector to communist North Korea wants to tell his story to put a human face on the Stalinist state which he believes is unfairly vilified abroad, British film-makers said.",0.0,0.5,"Last American defector in North Pyongyang agrees to tell story (AFP) AFP - The last surviving American defector to reds North Korea desiring to tell his story to presents a human tackled on the Stalinist public which he believed is unfairly blackballed abroad, British film-makers said.","Failed"
0.0,55.0,0.0,0.43333333333333335,"Live: Olympics day four Richard Faulds and Stephen Parry are going for gold for Great Britain on day four in Athens.",1.0,0.6,"Live: Olympics day four Richard Faulds and Stephen Parry are going for gold for Whopping Britain on day four in Athens.","Successful"
0.0,619.0,0.0,0.19999999999999996,"Kerry Widens Lead in California, Poll Finds (Reuters) Reuters - Democratic challenger John Kerry\has a commanding lead over President Bush in California of 54\percent to 38 percent among likely voters, a poll released on\Tuesday found.",0.0,0.5333333333333333,"Kerry Extends Leaded in California, Poll Finds (Reuters) Reuters - Democratic challenger John Kerry\is a commanding lead over Jefe Bush in California of 54\percent to 38 percent among likely voters, a poll released on\Tuesday found.","Failed"
1.0,31.0,1.0,0.23333333333333328,"Capacity Crowds at Beach Volleyball Rock the Joint  ATHENS (Reuters) - At the beach volleyball, the 2004  Olympics is a sell-out, foot-stomping success.",0.0,0.5,"Capacity Crowds at Beach Gymnastic Rock the Joint  ATHENS (Reuters) - At the beach volleyball, the 2004  Olympics is a sell-out, foot-stomping success.","Successful"
2.0,611.0,2.0,0.06666666666666665,"Dollar Near Recent Lows, Awaits ZEW/CPI  LONDON (Reuters) - The dollar held steady near this week's  four-week low against the euro on Tuesday with investors  awaiting a German investor confidence survey and U.S. consumer  inflation numbers to shed light on the direction.",2.0,0.2666666666666667,"Dollar Near Recent Lows, Awaits ZEW/CPI  LONDON (Reuters) - The dollar held steady near this week's  four-week low against the euro on Hier with investors  awaiting a German investor confidence survey and U.ies. consumer  inflation numbers to shed illumination on the direction.","Failed"
2.0,1.0,3.0,0.7666666666666666,"Intel to delay product aimed for high-definition TVs SAN FRANCISCO -- In the latest of a series of product delays, Intel Corp. has postponed the launch of a video display chip it had previously planned to introduce by year end, putting off a showdown with Texas Instruments Inc. in the fast-growing market for high-definition television displays.",3.0,0.7666666666666666,"Intel to delay product aimed for high-definition TVs SAN FRANCISCO -- In the latest of a series of product delays, Intel Corp. has postponed the launch of a video display chip it had previously planned to introduce by year end, putting off a showdown with Texas Instruments Inc. in the fast-growing market for high-definition television displays.","Skipped"
0.0,718.0,0.0,0.09999999999999998,"Venezuela vote keeps Chavez as president CARACAS -- Venezuelans voted resoundingly to keep firebrand populist Hugo Chavez as their president in a victory that drew noisy reactions yesterday from both sides in the streets. International observers certified the results as clean and accurate.",0.0,0.5666666666666667,"Venezuela vote keeps Fernandes as president CARACAS -- Venezuelans voted resoundingly to keep firebrand populist Hugo Chavez as their president in a victory that attractiveness noisy solution yesterday from both sides in the streets. International oversees certified the output as clean and accurate.","Failed"
0.0,437.0,0.0,0.033333333333333326,"Jailing of HK democrat in China 'politically motivated' (AFP) AFP - Hong Kong democrats accused China of jailing one of their members on trumped-up prostitution charges in a bid to disgrace a political movement Beijing has been feuding with for seven years.",0.0,0.23333333333333328,"Jailing of HK democrat in China 'politically motivated' (AFP) AFP - Hong Kong democrats accused China of jailing one of their representatives on trumped-up prostitution pricing in a bid to disgrace a political movement Beijing has been conflicts with for seven seniority.","Failed"
