"ground_truth_output","num_queries","original_output","original_score","original_text","perturbed_output","perturbed_score","perturbed_text","result_type"
2.0,141.0,2.0,0.24007487297058105,"Lazard adversaries edge closer to a deal Bruce Wasserstein, head of Lazard, could reach an agreement as early as this week with Michel David-Weill, the chairman, extending the deadline for ",3.0,0.6968183517456055,"Lazard adversaries edge closer to a deal Bruce Wasserstein, head of Lazard, could reach an arranging as early as this week with Michel David-Weill, the chairman, magnification the schedule for ","Successful"
3.0,164.0,3.0,3.719329833984375e-05,"European spacecraft prepares to orbit Moon Europes first lunar spacecraft is set to go into orbit around the Moon on Monday. SMART-1 has already reached the gateway to the Moon, the region where its gravity starts to dominate that of the Earth.",0.0,0.7095688581466675,"European spacing prepares to orbit Moon Europes first mel freighter is set to go into orbit around the Lune on Monday. SMART-1 ha already reached the fatma to the Moon, the region where its gravity starts to dominate that of the Earth.","Successful"
2.0,177.0,2.0,0.004631638526916504,"Fed lifts rates a further quarter point By Andrew Balls in Washington and Jennifer Hughes in New York. The US Federal Reserve on Tuesday raised interest rates by a quarter point to 2.25 per cent and signalled there had been no change in its assessment of economic conditions.",1.0,0.6673126220703125,"Nourished begs proportions a further quarter point By Andrew Balls in Washington and Jennifer Hughes in New York. The US Federation Stockpiled on Tuesday raised interest rates by a quarter point to 2.25 per cent and signalled there had been no change in its assessment of economically conditions.","Successful"
1.0,115.0,1.0,1.6689300537109375e-05,"Pepperdine 80, Fairleigh Dickinson 79 Glen McGowan had 22 points and little-used reserve Chase Griffin came off the bench to make two clutch free throws to help Pepperdine hold off Fairleigh Dickinson 80-79 Friday for fifth place in the BCA Invitational.",2.0,0.6414126753807068,"Pepperdine 80, Fairleigh Dickinson 79 Glen McGowan had 22 dowry and little-used reserve Chase Griffon inbound off the pew to make two clutch free throws to help Pepperdine hold off Fairleigh Dickinson 80-79 Friday for fifth place in the BCA Invitational.","Successful"
0.0,135.0,0.0,0.10530388355255127,"Indian-Americans hail Manmohan speech New York, Sep 27 (UNI) Members of the Indian-American community who attended a public meeting addressed by Prime Minister Manmohan Singh welcomed his speech and expressed confidence that India would soon be a developed economy.",2.0,0.532110333442688,"Indian-Americans hail Tiwari speech New York, Sep 27 (UNI) Members of the Indian-American community who attended a public meeting addressed by Prime Minister Manmohan Singh greeted his speech and expressed confidence that India would soon be a developed economy.","Successful"
3.0,1.0,2.0,0.7814346551895142,"Unisys to lay off 1,400 workers Unisys Corp. plans to cut 1,400 jobs, primarily in general and administrative areas, and consolidate its office space worldwide, it announced Wednesday. The cuts represent 3.8 percent of the company's staff of 37,000.",2.0,0.7814346551895142,"Unisys to lay off 1,400 workers Unisys Corp. plans to cut 1,400 jobs, primarily in general and administrative areas, and consolidate its office space worldwide, it announced Wednesday. The cuts represent 3.8 percent of the company's staff of 37,000.","Skipped"
2.0,115.0,2.0,0.0016036629676818848,"Dollar Mired Near Lows Before Jobs Data  LONDON (Reuters) - The dollar teetered just above nine-year  lows on a trade-weighted basis on Friday as investors waited  for key U.S. jobs data before deciding whether to extend the  greenback's recent decline.",1.0,0.6099539995193481,"Aussie Dunked Near Lows Before Jobs Data  LONDON (Reuters) - The wons teetered just above nine-year  lows on a trade-weighted basis on Friday as investors waited  for key U.S. jobs data before deciding whether to extend the  greenback's recent decline.","Successful"
0.0,170.0,0.0,2.384185791015625e-07,"Keep quiet on U.S. election, Martin tells loose-lipped cabinet (Canadian Press) Canadian Press - OTTAWA (CP) - Prime Minister Paul Martin served notice to his Liberal cabinet Thursday to clam up with their personal opinions on the U.S. presidential election.",2.0,0.5322978496551514,"Keep quiet on U.S. election, Martin tells loose-lipped cabinet (Canadian Press) Canadian Depress - NIAGARA (CP) - Prime Minster Paul Martin served notice to his Liberal cabinet Wed to clam up with their personal opinions on the U.S. presidential election.","Successful"
3.0,194.0,3.0,1.2755393981933594e-05,"Hobbit-sized Humans Called Homo floresiensis Discovered by &lt;b&gt;...&lt;/b&gt; Long live the real Bilbo Baggins, the first Little People of the World, Homo floresiensis and Homo sapien archeologists Michael Morwood, Peter Brown and Professor Soejono!",2.0,0.539528489112854,"Hobbit-sized Persons Called Homo floresiensis Found by &lt;b&gt;...&lt;/b&gt; Long live the real Bilbo Baggins, the first Little People of the World, Tata floresiensis and Homo sapien inquisitors Mikhail Morwood, Peters Brown and Professor Soejono!","Successful"
3.0,263.0,3.0,0.0010251998901367188,"Briefly: MSN Messenger beta leaks onto Web roundup Plus: Level 3 to buy Sprint's dial-up business...Cisco CEO's salary shoots up from \$1...SanDisk ups capacity on flash memory cards.",2.0,0.5796465873718262,"Briefly: MSN Messenger douche dumping onto Lnternet roundup Plus: Class 3 to buy Sprint's dial-up business...Cisco CEO's salary shoots up from \$1...SanDisk ups prerogatives on flash reminiscence cards.","Successful"
3.0,58.0,3.0,0.04705357551574707,"Global sales of mobile phones hit record levels PARIS Global cellphone sales rose to record levels in the second quarter as Nokia clawed back some of its lost market share, according to figures released Thursday.",2.0,0.5945085287094116,"Global sales of mobile phones hit record levels PARIS Global chattel sales rose to record levels in the second quarter as Cellphones clawed back some of its lost market share, according to figures released Thursday.","Successful"
1.0,521.0,1.0,0.0001055002212524414,"St. Louis Cardinals News Right-hander Matt Morris threw seven solid innings, but the Cardinals needed a bases-loaded walk to second baseman Tony Womack and a grand slam from new right fielder Larry Walker to key a six-run eighth inning for a ...",0.0,0.6738996505737305,"St. Louis Cardinals News Right-hander Matt Maurice spills seven audio innings, but the Cubs owes a bases-loaded walk to second bunt Tono Womack and a gros criticizes from new right outs Larry Walker to essentials a six-run eighth inning for a ...","Successful"
3.0,386.0,3.0,4.9591064453125e-05,"SpaceShipOne's 2nd Shot at X Prize Slated for Monday (SPACE.com) SPACE.com - The second attempt by the rocketplane SpaceShipOne to soar into space and snag \  the  #36;10 million Ansari X Prize is planned for Monday, officials announced last \  night.",0.0,0.5451052188873291,"SpaceShipOne's 2nd Shot at X Prix Slated for Domingos (SPACE.com) AEROSPACE.com - Both second tried by the rocketplane SpaceShipOne to raise into aerospace and anomaly \  the  #36;10 million Ansari X Recompense is waited for Monday, operatives announced earlier \  night.","Successful"
2.0,179.0,2.0,0.019849777221679688,"Spanish bank makes bumper profits The Spanish bank which is buying Abbey made a 2.2bn profit (3.1bn euros)in the first nine months of 2004. Banco Santander Central Hispano, which is acquiring the UK lender in a 8.",3.0,0.5566654205322266,"Spanish riverbank poses bumper accomplishments The Spanish banque which is buying Abbey made a 2.2bn profit (3.1bn euros)in the first nine months of 2004. Ribera Santander Central Hispano, which is acquiring the UK lender in a 8.","Successful"
3.0,271.0,3.0,0.007337808609008789,"Microsoft to delay advanced search technology from Longhorn Microsoft said Friday that it is delaying the release of a new data-storage technology, named WinFS, from the next version of Windows, code-named Longhorn, in order to deliver the operating system by 2006.",2.0,0.5726441144943237,"Microsoft to deferred lead searches technology from Longhorn Microsoft say Wed that it is delaying the release of a new data-storage technology, named WinFS, from the next stepping of Windows, code-named Longhorn, in edicts to deliver the jobs systemic by 2006.","Successful"
0.0,76.0,0.0,0.036287128925323486,"Soldier charged with murder A British soldier has been charged with the murder of a civilian in Iraq, police said. Trooper Kevin Lee Williams, 21, from the 2nd Royal Tank Regiment, is due to appear at Bow Street Magistrates Court.",2.0,0.6679277420043945,"Soldier charged with murder A British soldier has been charged with the murder of a civilian in Iraq, feds said. Trooper Kevin Lee Williams, 21, from the 2nd Royal Tank Regiment, is due to appear at Bow Street Magistrates Court.","Successful"
2.0,171.0,2.0,0.008194565773010254,"US Airways to Cut Hundreds of Jobs US Airways Group Inc. plans to eliminate ""hundreds"" of management and nonunion jobs and cut top executives' pay by between 5 and 10 percent.",3.0,0.8708442449569702,"US Airways to Cut Hundreds of Jobs WE Companies Module Inc. plans to eliminate ""hundreds"" of management and nonunion tasks and cut top executives' pay by between 5 and 10 percent.","Successful"
2.0,249.0,2.0,0.002411961555480957,"Putin Says State Companies May Buy Yukos Oil Assets (Update3) Russian President Vladimir Putin said state-run companies may bid for OAO Yukos Oil Co. assets in any sale to collect back taxes, raising the prospect of further government control over the nation #39;s oil and gas industry.",0.0,0.5765590667724609,"Putin Says State Companies May Bribed Yukos Oil Assets (Update3) Russian Leader Vladimir Putin proclaimed state-run enterprising may bid for OAO Yukos Oil Co. assets in any sale to collect back taxes, raising the prospect of further government control over the nation #39;s oil and gas industry.","Successful"
1.0,277.0,1.0,0.000644385814666748,"Sorenstam maintains Florida lead Annika Sorenstam could only manage a level-par 72 on day three of the ADT Tour Championship in Florida but it was enough to maintain a one-stroke lead.",0.0,0.5861436128616333,"Sorenstam confirms Florida lead Monika Sorenstam could only functioned a level-par 72 on jours two of the ADT Tours Featuring in Florida but it was enough to upkeep a one-stroke steered.","Successful"
2.0,111.0,2.0,0.03697258234024048,"Shoppers return in September, sales up 1.5 Shoppers were out last month, propelling sales at the nation #39;s retailers by a strong 1.5, best showing since March. The sizable gain reported by the Commerce Department on Friday came ",3.0,0.5504459142684937,"Shoppers return in September, filthy up 1.5 Users were out last month, propelling sales at the kraj #39;s retailers by a strong 1.5, best showing since March. The sizable gain reported by the Commerce Department on Friday came ","Successful"
2.0,86.0,2.0,0.004292607307434082,"J.E. Robert Assembles New Investment Fund J.E. Robert Cos. completed raising \$823 million from about 40 institutional and private equity investors this week.",3.0,0.6707753539085388,"J.E. Robert Assembles New Placements Monies jie.E. Robert Cem. completed raising \$823 million from about 40 institutional and private equity capital this week.","Successful"
1.0,148.0,1.0,0.00038492679595947266,"F1 debuts in China Formula One made its long-awaited debut in the People #39;s Republic of China today as the stunning new Shanghai International Circuit echoed to the banshee wail of Formula One engines being used in anger for the first time.",3.0,0.9688214063644409,"F1 debuts in China Formats One made its long-awaited premiered in the People #39;s Republic of China today as the extraordinaire newest Shanghai International Circuit echoed to the banshee wail of Formulation One engines being used in anger for the first time.","Successful"
3.0,143.0,3.0,0.0006389021873474121,"Bofra burrows in through banner ads Hackers may be using banner ad servers to multiply the impact of the Internet Explorer virus, security experts warn.",0.0,0.7955501079559326,"Bofra burrows in through banner ads Infiltrators may be using banner ad severs to multiply the impact of the Lnternet Searches virus, security experts warn.","Successful"
3.0,80.0,3.0,0.1809091567993164,"Yahoo: Internet withdrawal anguishing com September 22, 2004, 12:36 PM PT. This fourth priority #39;s main focus has been improving or obtaining CRM and ERP software for the past year and a half.",2.0,0.5865317583084106,"Yahoo: Network withdrawal anguishing com September 22, 2004, 12:36 H PT. These fourth priority #39;s main focus has been improving or obtaining CRM and ERP software for the past year and a half.","Successful"
2.0,345.0,2.0,0.004534661769866943,"UK #39;s Diageo gets \$2.26 bln from General Mills sale Britain #39;s Diageo Plc (DGE.L: Quote, Profile, Research) , the world #39;s biggest spirits group raised \$2.26 billion from its sale of 49.",3.0,0.7656084299087524,"UK #39;s Diageo gets \$2.26 bln from Unmitigated Vegetative sale Britain #39;s Diageo Plp (DGE.L: Quote, Profile, Research) , the planet #39;s worse soul teams raise \$2.26 trillion from its traded of 49.","Successful"
3.0,79.0,3.0,0.007502257823944092,"Metcalfe, Allen back ZigBee start-up Ember, a start-up that is developing chips for ZigBee--a low-cost, low-power wireless networking standard--received \$25 million in venture capital funding this week.",2.0,0.5205708742141724,"Metcalfe, Alana back ZigBee start-up Ember, a start-up that is developing nuggets for ZigBee--a low-cost, low-power wireless pails standard--received \$25 million in venture capital funding this week.","Successful"
1.0,284.0,1.0,0.0012531280517578125,"Mourinho happy after 3-0 win Chelsea manager Jose Mourinho was delighted with his side #39;s performance in the 3-0 win in the Champions League against Paris Saint Germain.",0.0,0.5578526258468628,"Mourinho lucky after 3-0 win Chelsea executives Gonzales Mourinho was pleasing with his parties #39;s performance in the 3-0 clockwork in the Champions League against Gaming Sant Schoen.","Successful"
0.0,275.0,0.0,1.6927719116210938e-05,"Roadside Bomb Injures Six GIs in Iraq (AP) AP - A roadside bomb exploded near an American military patrol in Baghdad Saturday, injuring six soldiers, the U.S. command said.",3.0,0.556647539138794,"Roadside Bomb Infects Sei GIs in Bagdad (AP) AP - para roadside blowup exploded near an American military periodicals in Afghanis Saturday, others eight soldiers, the U.S. command said.","Successful"
2.0,82.0,2.0,0.004930853843688965,"UPDATE 2-TD, Banknorth in talks on possible deal Toronto Dominion Bank (TD.TO: Quote, Profile, Research) said on Wednesday that it is in talks with US-based Banknorth Group (BNK.N: Quote, Profile, Research) about a possible deal, in line with the Canadian bank #39;s push for ",1.0,0.7114604115486145,"UPDATE 2-TD, Banknorth in talks on possible deal Toronto Dominion Rive (TD.TO: Quote, Profile, Research) said on Wednesday that it is in talks with US-based Banknorth Team (BNK.N: Quote, Profile, Research) about a possible deal, in line with the Canadian bank #39;s push for ","Successful"
2.0,127.0,2.0,0.01496124267578125,"Stocks to Watch on Dec. 1  NEW YORK (Reuters) - U.S. stocks to watch on Wednesday: IBM  CORP. &lt;A HREF=""http://www.investor.reuters.com/FullQuote.aspx?ticker=IBM.N target=/stocks/quickinfo/fullquote""&gt;IBM.N&lt;/A&gt;: The computer maker said it sealed deals worth  more than \$1 billion in new work with two European companies  from which the information technology company just acquired two  Danish services providers.",3.0,0.5834148526191711,"Stocks to Watch on Dec. 1  NEW YORKE (Reuters) - hu.S. stockpiled to watch on Wednesday: IBM  CORPS. &lt;A HREF=""http://www.investor.reuters.com/FullQuote.aspx?ticker=IBM.N target=/stocks/quickinfo/fullquote""&gt;IBM.N&lt;/A&gt;: The computer maker said it sealed deals worth  more than \$1 billion in new work with two European companies  from which the information technology company just acquired two  Danish services providers.","Successful"
0.0,75.0,0.0,0.19568097591400146,"After a decade of silence, Cambodia's cinema enjoys resurgence (AFP) AFP - After a decade of silence, Cambodia's movie industry is enjoying a boom due to a dash of Hollywood attention, burgeoning nationalism and cheaper production costs, industry insiders say.",3.0,0.6438636779785156,"After a decade of silence, Cambodia's cinema enjoys recovery (AFP) AFP - After a decade of silence, Cambodia's movie industry is enjoying a boom due to a dash of Hollywood attention, burgeoning chauvinism and cheaper production costs, industry insiders say.","Successful"
0.0,91.0,0.0,0.006197810173034668,"Democrat Seeks to End Iowa, N.H. Power (AP) AP - If Simon Rosenberg decides to run for Democratic Party chairman, he won't be able to count on much support from Iowa and New Hampshire.",3.0,0.5799500346183777,"Democrat Seeks to End Iowa, N.H. Power (AP) OA - If Simon Horowitz decides to run for Republican Party chairman, he won't be able to count on much support from Iowa and New Hampshire.","Successful"
1.0,181.0,1.0,0.0022552013397216797,"Today's schedule Pro baseball: AL Division Series -- Anaheim vs. Red Sox at Fenway Park (Game 3), 4 p.m.",2.0,0.951775312423706,"Today's programmed Pro baseball: AL Division Series -- Chula versus. Red Zambrano at Fen Yuen (Game 3), 4 p.billions.","Successful"
0.0,164.0,0.0,5.328655242919922e-05,"Two Palestinians kiled in a night raid against a warehouse in Gaza Israeli military helicopters yesterday evening bombarded by missiles a building in one of the refugee camps in the downtown of Gaza, while two Palestinians were killed and other three injured in the sector by the Israeli bullets.",1.0,0.6776697635650635,"Two Palestinians kiled in a night raid against a warehouse in Bunch Lsrael martial helo yesterday evening bombarded by missiles a building in one of the refugee camps in the downtown of Gaza, while two Israel were shot and other three injured in the sector by the Israeli bullets.","Successful"
1.0,137.0,1.0,0.040913403034210205,"He picked right time to start making shots Insecurity is a great motivator. Facing increasing criticism about his shot selection and the prospect of losing his starting job because of the return of two-time All-Star Allan Houston, young ",0.0,0.6976460218429565,"He picked right time to start making shots Insecurity is a great motivator. Frente increasing criticism about his shot selection and the prospect of offal his starting job because of the repatriated of two-time All-Star Allan Houston, young ","Successful"
2.0,247.0,2.0,0.0029792189598083496,"Jobless Claims Rise Unexpectedly  WASHINGTON (Reuters) - The number of Americans filing  initial claims for jobless pay grew unexpectedly last week to  357,000, Labor Department data showed on Thursday, but an  official said an increase in the week after a public holiday  was typical.",0.0,0.5862438678741455,"Jobless Claims Escalating Appallingly  DC (Reuters) - The number of Americans filing  initial claims for unemployed gratuity grow unexpectedly last week to  357,000, Labor Department data showed on Thursday, but an  official said an increase in the week after a public holiday  was typical.","Successful"
1.0,111.0,1.0,0.00395125150680542,"Seven-wicket Kumble destroys Australia India #39;s spin king Anil Kumble grabbed seven wickets for 25 runs to skittle world champions Australia for 235 in a dramatic start to the second Test on Thursday.",0.0,0.6474462747573853,"Seven-wicket Kumble destroys Australia India #39;s spin king Anil Kumble nabbed seven booths for 25 runs to skittle world activists Australia for 235 in a dramatic start to the second Test on Thursday.","Successful"
3.0,80.0,3.0,0.10989421606063843,"First Look: RemoteTV Offers Slick Media Streaming Belkin's latest product lets you effortlessly share digital content within the house, but is it lawful?",2.0,0.5116722583770752,"First Look: RemoteTV Offers Slick Media Streaming Belkin's latest product lets you comfortably share electronic contented within the house, but is it lawful?","Successful"
3.0,146.0,3.0,0.03660660982131958,"Jobs #39; Apple vs Beatles #39; Apple p2pnet.net News:- It #39;s Apple vs Apple again - that #39;s to say Steve Jobs #39; Apple versus The Beatles #39; Apple. Apple-B claims Apple-J infringes its trade mark and the latter,  quot;is likely to be forced into a multimillion ",2.0,0.526093602180481,"Jobs #39; Pie vs Orbison #39; Mitt p2pnet.net News:- It #39;s Apple vs Apple again - that #39;s to say Steve Jobs #39; Apple versus The Musicians #39; Apple. Apple-B claims Apple-J infringes its trade mark and the latter,  quot;is likely to be forced into a multimillion ","Successful"
1.0,1.0,2.0,0.9262301921844482,"INSIDE INFO: Man Utd shares drop MAN UNITED #39;S share price has fallen by just over 2.5, less than expected after the resignation of Malcolm Glazer #39;s bankers JP Morgan.",2.0,0.9262301921844482,"INSIDE INFO: Man Utd shares drop MAN UNITED #39;S share price has fallen by just over 2.5, less than expected after the resignation of Malcolm Glazer #39;s bankers JP Morgan.","Skipped"
3.0,247.0,3.0,0.00603407621383667,"Microsoft's Live Communications Server may drive interest in enterprise IM With Microsoft's new Live Communications Server 2005 due out in December, enterprise IM users and vendors are eyeing new opportunities for more secure messaging in the workplace.",2.0,0.578471302986145,"Microsoft's Live Communications Waitress may motor interest in enterprise IM Under Microsoft's new Live Communications Officials 2005 due out in December, enterprise IM users and vendors are eyeing newest opportunities for more guaranty announcements in the workplace.","Successful"
0.0,218.0,0.0,9.691715240478516e-05,"UN urges dialogue after Rwanda vows action Rwanda insisted on Thursday that it would soon attack rebels inside the Democratic Republic of Congo unless they were disarmed, as the United Nations Security ",3.0,0.609714686870575,"UN entreat dialog after Tutsis newbies action Rwanda urged on Thursday that it would soon attack revolts inside the Democratic Republic of Congo unless they were disarmed, as the United Nations Security ","Successful"
1.0,105.0,1.0,0.005399823188781738,"O's Still Fishing With big fish like Richie Sexson still looking for work and prizes like Tim Hudson being dangled in the market, the Orioles remain hopeful that they can bag a big catch.",2.0,0.6977754831314087,"O's Still Fishing With big fish like Knowles Sexson increasingly looking for work and prizes like Tim Westchester being dangled in the market, the Baltimore remain rosy that they can bag a big catch.","Successful"
0.0,51.0,0.0,0.33807802200317383,"Terror is below radar in Russia It took 2 days for Russia #39;s security service to announce what virtually everyone else believed from the moment two domestic passenger airlines plunged to earth simultaneously ",2.0,0.7522623538970947,"Terror is below radar in Ruble It took 2 days for Russia #39;s security service to announce what virtually everyone else believed from the moment two domestic passenger airlines plunged to earth simultaneously ","Successful"
0.0,34.0,0.0,0.3291431665420532,"Briefly: Israel, Egypt and US trade pact Egypt, Israel and the United States have reached an agreement that allows Egyptian industry to sell products using Israeli parts duty free in America.",2.0,0.5972929000854492,"Briefly: Israel, Egypt and US trade pact Egypt, Israel and the United States have reached an agreement that allows Egyptian industry to sell products using Jewish parts duty free in America.","Successful"
2.0,202.0,2.0,0.0018022656440734863,"US may draw on oil in reserve WASHINGTON Oil prices climbed toward \$49 per barrel Thursday even as the Bush administration considered drawing crude from the US emergency stockpile and lending it to refiners whose supplies were disrupted by Hurricane Ivan.",0.0,0.5410423278808594,"US may draw on oil in reserve WASHINGTON Hydrocarbon toll escalation toward \$49 per barrel Thursday even as the Bush administration considered drawing crude from the US emergency stockpile and poised it to refiners whose supplies were disrupted by Hurricane Ivan.","Successful"
3.0,146.0,3.0,0.0003857612609863281,"Dell and Microsoft Launch Joint Software (AP) AP - Dell Inc. and Microsoft Corp. promised big savings on the billions of dollars companies spend on system maintenance as they unveiled jointly developed software Monday that manages and upgrades servers in one mouse-click.",2.0,0.5847331285476685,"Dell and Microsoft Lance Mutual Sw (AP) HAD - Del Lnc. and Microsoft Corp. promised big savings on the billions of dollars companies spend on system maintenance as they unveiled jointly developed software Monday that manages and upgrades busboy in one mouse-click.","Successful"
3.0,272.0,3.0,0.0016739964485168457,"Phishing on the increase, group says (InfoWorld) InfoWorld - Online phishing schemes increased significantly in October as financial institutions struggled to combat attempts to steal private account information from online consumers, according to the Anti-Phishing Working Group (APWG).",2.0,0.5521537065505981,"Phishing on the increase, group says (InfoWorld) InfoWorld - Otta phishing schemes broaden significantly in October as financial institutions struggled to brawls efforts to steal private account information from lnternet consumers, complying to the Anti-Phishing Operated Group (APWG).","Successful"
