"ground_truth_output","num_queries","original_output","original_score","original_text","perturbed_output","perturbed_score","perturbed_text","result_type"
3.0,113.0,3.0,0.18992048501968384,"RTX Provides Cordless Phones for Net-Based Calls  COPENHAGEN (Reuters) - Danish electronics equipment maker  RTX Telecom &lt;A HREF=""http://www.reuters.co.uk/financeQuoteLookup.jhtml?ticker=RTX.CO qtype=sym infotype=info qcat=news""&gt;RTX.CO&lt;/A&gt; said on Monday it had signed an agreement  with Skype, a provider of Internet-based voice telephony, to  develop and market cordless handsets.",2.0,0.5154452919960022,"RTX Donne Cordless Phones for Net-Based Calls  COPENHAGEN (Reuters) - Danish electronics equipment maker  RTX Telecom &lt;A HREF=""http://www.reuters.co.uk/financeQuoteLookup.jhtml?ticker=RTX.CO qtype=sym infotype=info qcat=news""&gt;RTX.CO&lt;/A&gt; said on Monday it had signed an agreement  with Skype, a provider of Internet-based voice telephony, to  develop and market cordless handsets.","Successful"
0.0,117.0,0.0,0.00036776065826416016,"Turkish Company Freezes Operations in Iraq (AP) AP - A Turkish construction company announced Tuesday that it was halting operations in neighboring Iraq in a bid to save the lives of 10 employees kidnapped by militants.",3.0,0.7254896759986877,"Turkish Company Freezes Operations in Bagdad (AP) HAS - para Turkish construction company announced Tuesday that it was halting endeavors in closeness Bagdad in a bid to save the lives of 10 employees kidnapped by militants.","Successful"
2.0,126.0,2.0,0.002069234848022461,"Delta Pilots Ratify Concession Package  CHICAGO (Reuters) - Pilots at Delta Air Lines Inc. on  Thursday ratified a concession package that will save the  carrier \$1 billion a year, in a move the company hopes will buy  it time to restructure outside of bankruptcy.",3.0,0.5053309202194214,"Delta Pilots Ratify Concession Package  MIAMI (Reuters) - Pilots at Daemon Aeronautics Lines Inc. on  Thursday ratified a concession package that will save the  carrier \$1 billion a year, in a move the company hopes will buy  it time to restructure outside of bankruptcy.","Successful"
1.0,335.0,1.0,3.170967102050781e-05,"Arsenal only manage draw LONDON - Arsenal manager Arsene Wenger has praised Thierry Henry #39;s speed of thought after the striker stroked home a quick free-kick that helped champions Arsenal to a 2-2 draw against Premiership leaders Chelsea at Highbury last night.",0.0,0.7093608379364014,"Arsenal only manage draw LONDON - Arsenal manager Arsene Arsene has acclaimed Terry Gustav #39;s speed of thought after the wrack knelt home a punctual free-kick that helped champions Arsenal to a 2-2 seduction against Premiership leaders Fulham at Mews former night.","Successful"
0.0,172.0,0.0,0.012362837791442871,"Philippines not relieved from nature #39;s curse With the death toll mounting to 1,000 after a deadly storm Typhoon Nanmadol that hit the nation three days before, the nature #39;s curse is still haunting Philippines when an earthquake with a preliminary magnitude of 4.2 rocked the northern Philippines on ",1.0,0.7367596626281738,"Philippines not relieved from nature #39;s curse With the death toll mounting to 1,000 after a letal thunder Tessie Nanmadol that hit the nation three days before, the nature #39;s curse is still haunting Philippines when an earthquake with a preliminary magnitude of 4.2 struck the northern Philippines on ","Successful"
0.0,130.0,0.0,0.0021816492080688477,"Britain Ups Anti-Terror Security Spending (AP) AP - The Sept. 11 attacks on America forced Prime Minister Tony Blair's government to ponder a troubling question: Could terrorists pull off something similar, or even worse, in London or another big British city? The answer, they concluded, was yes.",3.0,0.6402616500854492,"Britain Ups Anti-Terror Security Spending (AP) HECTARES - The Sept. 11 attacks on America forced Premium Chairwoman Tony Blair's govern to ponder a troubling question: Could terrorists pull off something similar, or even worse, in London or another big British city? The answer, they concluded, was yes.","Successful"
1.0,133.0,1.0,3.6954879760742188e-06,"Glazer could bid for Manchester United this week: reports LONDON : US sports tycoon Malcolm Glazer could launch a takeover bid for English football giants Manchester United this week after securing financing and making contact with the club #39;s largest shareholders, newspapers here reported.",2.0,0.5234372615814209,"Glazer could bid for Manchester United this week: reports LONDON : US recreation tycoon Martine Goldfarb could launch a takeover bid for English football giants Brighton United this week after securing financing and making contact with the club #39;s largest shareholders, newspapers here reported.","Successful"
1.0,71.0,1.0,0.02378237247467041,"AL Capsules Vernon Wells hit a go-ahead, two-run triple off Orlando Hernandez in the seventh inning, and the Toronto Blue Jays rallied past the New York Yankees 5-4 on Wednesday night.",0.0,0.5135945081710815,"AL Shelves Vernon Cavities hit a go-ahead, two-run triple off Orlando Hernandez in the seventh inning, and the Toronto Blue Jays rallied past the New York Yankees 5-4 on Wednesday night.","Successful"
0.0,266.0,0.0,0.0003160238265991211,"Israeli troops kill Gaza militant At least one Palestinian is shot dead by Israeli troops as he attacked a checkpoint near Gaza City.",3.0,0.5285457372665405,"Zionist militar kill Banding warrior At least one Israeli is shot dead by Judaism force as he blasted a reviews near Gaza City.","Successful"
2.0,62.0,2.0,0.4041444659233093,"Telekom Austria taps the Bulgarian market Telekom Austria, Austrias largest telecoms operator, obtained access to the relatively underdeveloped East European mobile services market by winning the right to purchase the Bulgarian mobile operator MobilTel for 1.6billion (\$2.12billion).",3.0,0.6563040018081665,"Telekom Austria taps the Bulgarian market Telekom Austria, Austrias largest telecoms operator, obtained access to the relatively underdeveloped East European mobile services market by winning the right to purchase the Bulgarians mobile operator MobilTel for 1.6billion (\$2.12billion).","Successful"
0.0,58.0,0.0,0.29899972677230835,"New EU Executive Chief Announces Revamped Team The incoming head of the European Union #39;s executive body has announced changes to his group of commissioners and says he is ready to go to the European Parliament to seek its approval of his team.",3.0,0.7374284267425537,"New UE Executive Chief Announces Revamped Team The incoming head of the European Union #39;s executive body has announced changes to his group of commissioners and says he is ready to go to the European Parliament to seek its approval of his team.","Successful"
2.0,150.0,2.0,0.0015529990196228027,"CBA to purchase local lender #39;s share Commonwealth Bank of Australia (CBA) said yesterday it was in talks with the Jinan City Commercial Bank (JNCCB) about buying a stake in the regional lender.",3.0,0.5605499744415283,"CBA to bought local loaner #39;s share Federally Lakeshore of Tasmania (CBA) said yesterday it was in talks with the Jinan City Commercial Riverbank (JNCCB) about pimping a stake in the regional lender.","Successful"
2.0,1.0,0.0,0.8525012731552124,"Labor situation deserves honest talk For a moment last week, President Bush escaped the White House spin chamber and was the plainspoken man much of the nation came to like four years ago.",0.0,0.8525012731552124,"Labor situation deserves honest talk For a moment last week, President Bush escaped the White House spin chamber and was the plainspoken man much of the nation came to like four years ago.","Skipped"
1.0,270.0,1.0,5.0067901611328125e-06,"Valencia accept Angulo ban Valencia say they do not plan to appeal against the seven-match ban given to midfielder Miguel Angel Angulo by UEFA for his behaviour during last week #39;s Champions League match against Werder Bremen.",0.0,0.5015442967414856,"Lecce acknowledged Angulo ban Lazio assert they do not plan to appeal against the seven-match ban given to midfielder Alejandro Beloved Angulo by COPA for his behaviour during last week #39;s Champions League contra against Werder Bremen.","Successful"
1.0,160.0,1.0,0.000878751277923584,"Natalie Coughlin Wins 100M Backstroke (AP) AP - American Natalie Coughlin won Olympic gold in the 100-meter backstroke Monday night. Coughlin, the only woman ever to swim under 1 minute in the event, finished first in 1 minute, 0.37 seconds. Kirsty Coventry of Zimbabwe, who swims at Auburn University in Alabama, earned the silver in 1:00.50. Laure Manaudou of France took bronze in 1:00.88.",0.0,0.5131431818008423,"Natalie Coughlin Wins 100M Backstroke (AP) AP - American Delphine Coughlin won Olympiad gold in the 100-meter backstroke Monday night. Coughlin, the only woman ever to swim under 1 minute in the event, finished first in 1 minute, 0.37 seconds. Kirsty Coventry of Zimbabwe, who swims at Lustrous Schools in Alabama, earned the silver in 1:00.50. Laure Manaudou of French took bronze in 1:00.88.","Successful"
3.0,268.0,3.0,0.00014257431030273438,"Solar spacecraft set to launch next year The \$4 million Cosmos 1 project is backed by The Planetary Society, co-founded by Carl Sagan. By The Associated Press. A solar sail spacecraft designed to be propelled by the pressure of sunlight will be launched ",2.0,0.5309019684791565,"Solar spacecraft set to launch next year The \$4 million Cosmos 1 intends is backed by The Star Society, co-founded by Karel Sagan. For The Associated Press. A willow yachts shipping fated to be propelled by the pressure of sunlight will be launched ","Successful"
2.0,141.0,2.0,0.023859739303588867,"Retailers Vie for Back-To-School Buyers (Reuters) Reuters - Apparel retailers are hoping their\back-to-school fashions will make the grade among\style-conscious teens and young adults this fall, but it could\be a tough sell, with students and parents keeping a tighter\hold on their wallets.",3.0,0.7079719305038452,"Retailers Vie for Back-To-School Buyers (Reuters) Reuters - Whatnot dopers are hoping their\back-to-school fashions will make the grade among\style-conscious teens and young adults this fall, but it could\be a tough sell, with students and parents keeping a tighter\hold on their wallets.","Successful"
2.0,101.0,2.0,0.027135908603668213,"Metropolitan Life Mandates Banks For Sterling Bond LONDON (Dow Jones)--Metropolitan Life Global Funding has mandated HSBC, Deutsche Bank and Royal Bank of Scotland to lead-manage its forthcoming sterling-denominated bond issue, one of the lead managers said Thursday.",3.0,0.5892831087112427,"Underpass Life Mandate Seashore For Sterling Bond LONDON (Dow Jones)--Metropolitan Life Global Funding has mandated HSBC, Deutsche Bank and Royal Bank of Scotland to lead-manage its forthcoming sterling-denominated bond issue, one of the lead managers said Thursday.","Successful"
0.0,1.0,3.0,0.7879155874252319,"Stability Control Systems Can Save Lives (AP) AP - Stability control systems could save up to 7,000 lives each year if they were standard equipment on all vehicles, according to a study by the insurance industry.",3.0,0.7879155874252319,"Stability Control Systems Can Save Lives (AP) AP - Stability control systems could save up to 7,000 lives each year if they were standard equipment on all vehicles, according to a study by the insurance industry.","Skipped"
2.0,174.0,2.0,0.005176901817321777,"EADS Offers to Split U.S. Tanker Deal With Boeing European Aeronautic Defense and Space Co., the parent of aircraft maker Airbus SAS, has proposed splitting a contested U.S. Air Force contract for refueling tankers with its rival Boeing Co., the European group's U.S. office said Friday.",3.0,0.5994036197662354,"EADS Offers to Split U.S. Tanker Deal With Aeronautics European Aeronautic Tusks and Space Co., the parent of aircraft fabrication Airbus SAS, has proposed splitting a contested U.S. Atmospheric Force contract for refueling tankers with its rival Boeing Co., the European group's U.S. office said Friday.","Successful"
3.0,101.0,3.0,0.10295975208282471,"Germans Use Nokia Phones in Wireless Ticket Trial The world #39;s top mobile phone maker Nokia said on Tuesday its phones would be used in a project to test wireless public transport fares in Hanau, near Frankfurt in Germany, beginning early next year.",2.0,0.5426434278488159,"Germans Use Nokia Phones in Wireless Ticket Trial The world #39;s top mobile phone maker Nokia said on Tuesday its phones would be used in a project to audits cordless inhabitant transport fares in Hanau, near Frankfurt in Germany, beginning early next year.","Successful"
1.0,276.0,1.0,8.33272933959961e-05,"Inzaghi fit for start of season AC Milan striker Filippo Inzaghi is fit for the start of the Serie A season after recovering from an ankle injury, the club said on Thursday.",0.0,0.5444453954696655,"Inzaghi monte for start of season NOC Milan attacker Battista Inzaghi is fit for the embarked of the Serie A season after recovering from an pillar injury, the cabaret said on Thursday.","Successful"
1.0,136.0,1.0,0.0526697039604187,"Sete returns to top form in Qatar; Edwards joins party with runner &lt;b&gt;...&lt;/b&gt; Sete Gibernau will go down in history as the first ever winner of the Grand Prix of Qatar after an incredible race today which he led from start ",0.0,0.5947312116622925,"Sete returns to top form in Qatar; Edwards joins party with runner &lt;b&gt;...&lt;/b&gt; Sete Gibernau will go down in history as the first ever winner of the Grand Prices of Qatar after an incredible groceries currents which he led from start ","Successful"
1.0,46.0,1.0,0.0010782480239868164,"Ohio State Bomb Dogs Irk Michigan Coach (AP) AP - The intense rivalry between Ohio State and Michigan has gone to the dogs  #151; bomb-sniffing ones.",3.0,0.9506787061691284,"Ohio State Bomb Dogs Irk Mich Bus (AP) AP - The intense rivalry between Ohio State and Michigan has gone to the dogs  #151; bomb-sniffing ones.","Successful"
0.0,146.0,0.0,0.044391751289367676,"Facing Arrest, Uma Bharti Quits as Madhya Pradesh Chief BHOPAL (PTI) - Madhya Pradesh Chief Minister Uma Bharti has been forced out of office after four days of political drama as the issue of tainted ministers came back to haunt the Bharatiya Janata Party.",2.0,0.5581790208816528,"Facing Arrest, Uma Bharti Quits as Madhya Pradesh Chief BHOPAL (PTI) - Madhya Pradesh Skippers Secretarial Uma Bharti has been forced out of office after four days of political drama as the issue of tainted ministers came back to haunt the Bharatiya Janata Party.","Successful"
3.0,172.0,3.0,0.1460774540901184,"Did Apple Offer Sony an ITunes Deal? Update: A partnership may be crucial for long-term success, one industry insider says.",2.0,0.530784010887146,"Took Mitt Offer Matsushita an ITunes Address? Update: A cooperatives may be vitale for long-term success, one industry insider says.","Successful"
2.0,148.0,2.0,0.0010409355163574219,"Enbridge to Buy Some of Shell's Pipelines  TORONTO (Reuters) - Enbridge Inc. &lt;A HREF=""http://www.investor.reuters.com/FullQuote.aspx?ticker=ENB.TO target=/stocks/quickinfo/fullquote""&gt;ENB.TO&lt;/A&gt; will buy Shell's  Gulf of Mexico natural gas pipelines for \$613 million in a move  that will make it a major transporter in the huge gas-producing  area, Canada's No. 2 pipeline company said on Wednesday.",3.0,0.5568605661392212,"Enbridge to Buy Some of Shell's Gaines  CANADIANS (Reuters) - Enbridge Lnc. &lt;A HREF=""http://www.investor.reuters.com/FullQuote.aspx?ticker=ENB.TO target=/stocks/quickinfo/fullquote""&gt;ENB.TO&lt;/A&gt; will buy Shell's  Gulf of Mexico natural gas pipelines for \$613 million in a move  that will make it a major transporter in the huge gas-producing  area, Canada's No. 2 pipeline enterprise said on Wednesday.","Successful"
0.0,171.0,0.0,0.00898510217666626,"30,000 More Sudanese Threaten to Cross to Chad -UN (Reuters) Reuters - Some 30,000 Sudanese, victims of fresh\attacks by Arab militia inside Darfur, have threatened to cross\into Chad, the U.N. refugee agency warned on Friday.",3.0,0.7456949949264526,"30,000 More Sudanese Undercutting to Cross to Chad -UN (Reuters) Reuters - Some 30,000 Sudanese, victims of fresh\attacks by Saudi militia inside Darfur, have threatened to cross\into Chad, the U.p. nuthouse agency prudential on Friday.","Successful"
1.0,188.0,1.0,0.0004360079765319824,"Orioles to get paid off for Expos #39; move to DC In this crevice of the baseball globe, as the season heads to the bottom of the ninth, nothing has changed. It #39;s an annual rite for both teams by the bay to be in prime playoff position with a week to go, and ",0.0,0.5539840459823608,"Tejada to get paid off for Exposures #39; move to DC In this chink of the dingbat globe, as the season heads to the bottom of the ninth, nothing has changed. It #39;s an annual rite for both accoutrements by the bay to be in prime playoff philosophies with a week to go, and ","Successful"
0.0,101.0,0.0,0.002682030200958252,"Chinese President Meets With Castro (AP) AP - Chinese President Hu Jintao met with Fidel Castro Monday for talks focusing on the broadening ties between Cuba and China, which has become the island's third-largest trading partner.",2.0,0.5795332193374634,"Chinese President Meets With Ortiz (AP) HECTARES - Chinese President Hu Jintao met with Fidel Castro Monday for talks focusing on the broadening ties between Cuban and China, which has become the island's third-largest trading partner.","Successful"
0.0,109.0,0.0,0.0026178956031799316,"2 Ex-Officers Nabbed in Venezuela Slaying National Guard troops arrested two brothers Friday in connection with a state prosecutor's killing, just days after two suspects in the car bombing case were shot dead by police, authorities said.",2.0,0.6594120860099792,"2 Ex-Officers Nabbed in Venezuela Slaying National Safekeeping quotas arrested two brothers Friday in connection with a state prosecutor's killing, just days after two suspects in the car bombing case were shot dead by police, authorities said.","Successful"
0.0,48.0,0.0,0.023279845714569092,"South Koreans Say Secret Work Refined Uranium South Korea admitted that a group of its nuclear scientists secretly produced a small amount of near-weapons grade uranium.",3.0,0.518210768699646,"South Koreans Say Secret Work Refined Uranium South Kori admitted that a group of its radioactive scientists secretly produced a small amount of near-weapons grade uranium.","Successful"
3.0,82.0,3.0,0.0960921049118042,"Cisco Bolsters Its Security Story The move won #39;t have raised many eyebrows. Security is a hot market in which Cisco already has a strong grip in the enterprise space, and the vendor giant has already bolstered its security portfolio through ",2.0,0.6456947922706604,"Cisco Bolsters Its Security Story The move won #39;t have raised many eyebrows. Security is a hot market in which Cisco already has a strong grip in the enterprise space, and the vendor giant has already bolstered its guaranty portfolios through ","Successful"
2.0,124.0,2.0,0.033335089683532715,"Atlantic City settlement In an agreement that could have significant implications for locked- out San Francisco hotel workers, striking casino workers in Atlantic City today are expected to ratify a deal that offers lucrative benefits but abandons the union #39;s strategy to ",3.0,0.558018684387207,"Atlantic City settlement In an agreement that could have significant implications for locked- out San Francisco hotel workers, striking games officials in Atlantic City today are expected to ratify a deal that offers lucrative benefits but abandons the union #39;s strategy to ","Successful"
1.0,103.0,1.0,0.12599778175354004,"Stephen Dodd leads Volvo China Open Stephen Dodd took a three-stroke lead Friday after 36 holes of the Volvo China Open in Shanghai to stand six-under-par 138 after two rounds.",0.0,0.6267077922821045,"Stephen Dodd leads Volvo China Opens Stephen Dodd took a three-stroke lead Friday after 36 crevices of the Volvo China Open in Shanghai to stand six-under-par 138 after two rounds.","Successful"
0.0,160.0,0.0,0.02110069990158081,"The power of radio helps to end Uganda #39;s long war When Kenneth Banya heard the voices of his former rebel colleagues on the radio calling for an end to Uganda #39;s 18-year civil war, he knew it was time to surrender.",1.0,0.6320329308509827,"The power of radio helps to end Rwandan #39;s long carew When Kenneth Banya realized the vowel of his former putsch colleagues on the radio calling for an end to Uganda #39;s 18-year civil war, he knew it was time to surrender.","Successful"
1.0,86.0,1.0,0.03767967224121094,"Sluman, Byrd split lead; many bubbles burst Jeff Sluman and Jonathan Byrd were tied for the lead at the Chrysler Championship, both knowing the tournament really doesn #39;t start until the weekend.",2.0,0.5169731378555298,"Sluman, Byrd splitting lead; many bubbles burst Jeff Sluman and Jonathan Byrd were tied for the lead at the Chrysler Championship, both knowing the regionals really doesn #39;t start until the weekend.","Successful"
2.0,111.0,2.0,0.02643406391143799,"Qwest to pay \$250 million to end probe WASHINGTON (CBS.MW) -- Qwest Communications on Thursday said it #39;s agreed to pay \$250 million to end a federal probe of allegedly fraudulent accounting practices used by former executives.",3.0,0.5239256024360657,"Qwest to pay \$250 million to end probe WASHINGTON (CBS.MW) -- Qwest Messaging on Mardi said it #39;s agreed to pay \$250 million to end a federal probe of allegedly fraudulent accounting practices used by former executives.","Successful"
3.0,85.0,3.0,0.0962485671043396,"Google Unveils Scholar Search Tool JACKSONVILLE, FL -- The online search engine leader Google has unveiled a new tool for scholarly research. The new service is aimed at making better sense of all the scholarly work stored on the web and it ",2.0,0.5708878040313721,"Google Unveils Scholar Search Tool JACKSONVILLE, FL -- The online search engine leader Google has unveiled a new tool for scholarly research. The new service is aimed at making better sense of all the scholarly works godown on the web and it ","Successful"
0.0,89.0,0.0,0.07625436782836914,"Pinochet is ordered to stand trial for murder Augusto Pinochet, the former Chilean dictator, was ordered under house arrest yesterday, charged with kidnapping and murder dating back to his 17-year rule.",1.0,0.6116580963134766,"Pinochet is ordered to stand trial for killin Augusta Pinochet, the former Chilean dictator, was ordered under house arrest yesterday, charged with kidnapping and murder dating back to his 17-year rule.","Successful"
3.0,163.0,3.0,0.00019818544387817383,"SpaceShipOne Lands After 2nd Flight MOJAVE, Calif. - The private manned rocket SpaceShipOne (search) streaked toward space early Monday in a bid to top an altitude of 62 miles for the second time in six days and claim the \$10 million Ansari X Prize (search).",0.0,0.7629227638244629,"SpaceShipOne Lands After 2nd Flight MOJAVE, Calif. - The private pilot grenade SpaceShipOne (search) fluttered toward space early Monday in a bid to top an altitude of 62 miles for the second time in six days and claim the \$10 million Ansari X Fellowship (search).","Successful"
2.0,82.0,2.0,0.005024313926696777,"Clayton Dubilier, Merrill team in \$3.4B buyout In what would be the largest European leveraged buyout of the year, Clayton Dubilier  amp; Rice has teamed with Merrill Lynch  amp; Co.",1.0,0.6138830184936523,"Clayton Dubilier, Bastien teams in \$3.4B redeeming In what would be the largest European leveraged buyout of the year, Clayton Dubilier  amp; Rice has teamed with Bastien Lynch  amp; Capitaine.","Successful"
2.0,1.0,0.0,0.8475191593170166,"Ahold to Sell Spain Operations to Permira (AP) AP - The Dutch supermarket retailer Ahold, seeking to streamline global operations and reduce debt, said Sunday it will sell its holdings in Spain to Permira Funds for about  #36;849 million.",0.0,0.8475191593170166,"Ahold to Sell Spain Operations to Permira (AP) AP - The Dutch supermarket retailer Ahold, seeking to streamline global operations and reduce debt, said Sunday it will sell its holdings in Spain to Permira Funds for about  #36;849 million.","Skipped"
1.0,129.0,1.0,0.00010609626770019531,"NFL Preview: Another streak mark looming for Patriots Until the final 11 minutes of the Rams-Seahawks game last week, Seattle #39;s visit to New England this Sunday looked like one of those overhyped matchups labelled  quot;Super Bowl Preview quot; or  quot;Streak-Ender.",3.0,0.681145429611206,"TEXANS Previews: Another streak mark looming for Patriot Until the final 11 minutes of the Rams-Seahawks jeu last week, Seattle #39;s visit to New England this Sunday looked like one of those overhyped matchups tagging  quot;Super Goblet Preview quot; or  quot;Streak-Ender.","Successful"
0.0,106.0,0.0,0.00020641088485717773,"World News: Zimbabwe jails UK  #39;coup plotter #39; The British leader of a group of 67 alleged mercenaries accused of plotting a coup in Equatorial Guinea has been sentenced to seven years in jail.",3.0,0.6085386276245117,"World News: Rhodesia slammer UK  #39;coup tracer #39; The British leader of a group of 67 alleged mercenaries accused of plotting a coup in Orbiting Tropical has been sentenced to seven years in jail.","Successful"
