"ground_truth_output","num_queries","original_output","original_score","original_text","perturbed_output","perturbed_score","perturbed_text","result_type"
3.0,221.0,3.0,0.0030683279037475586,"Nokia Adopts SD Card Tech into Storage Portfolio To expand the capabilities of SD memory cards in mobile devices, the SD Card Association has recently formed a Mobile Phone Task Force.",2.0,0.5919173359870911,"Motorola Adopts SD Card Tech into Storage Portfolio To expand the capabilities of SD reminiscence cards in mobile devices, the SD Card Cooperatives owns recently formed a Mobile Phoning Labor Vigour.","Successful"
0.0,77.0,0.0,0.07696568965911865,"Iraq video shows 'hostage deaths' A video is released which apparently shows the killing of  two hostages in Iraq, while two others are released.",3.0,0.7297424077987671,"Bagdad video shows 'hostage deaths' A video is released which apparently shows the killing of  two captivity in Iraq, while two others are released.","Successful"
0.0,85.0,0.0,0.030818641185760498,"Princess Diana Fountain to Close Again (AP) AP - It has been fenced in, clogged with leaves, overrun with visitors and even used as a dog bath. Now the Princess Diana memorial fountain is to close again to replace surrounding grass that has become sodden with splashing water, park officials said Tuesday.",1.0,0.6546213626861572,"Princess Diana Fountain to Close Again (AP) AP - It has been fenced in, clogged with leaves, overrun with visitors and even used as a dog bath. Now the Princesa Tatjana memorial fountain is to close again to replace surrounding grass that has become sodden with splashing water, park officials said Tuesday.","Successful"
2.0,89.0,2.0,0.1840340495109558,"Supreme Court turns down  #39;Do Not Call #39; case SUPREME COURT - The Supreme Court is refusing to hear a challenge to the federal do-not-call telephone registry. Telemarketers have been trying to invoke free-speech rights to do away with the ban on unwanted phone solicitations.",3.0,0.7686992883682251,"Supreme Court turns down  #39;Do Not Call #39; case SUPREME COURT - The Supreme Court is refusing to hear a challenge to the sate do-not-call telephone registry. Telemarketers have been trying to evoking free-speech rights to do away with the ban on unwanted phone solicitations.","Successful"
0.0,60.0,0.0,0.13952600955963135,"No negotiation and no retreat, vows Bush When it came, the statement broadcast by the al-Jazeera Arabic news channel from Qatar was as chilling as it was ghoulish: A second American captive, Jack Hensley, 48, had ",2.0,0.6499212980270386,"No negotiation and no retreat, vows Bush When it came, the statement broadcast by the al-Jazeera Saudis newsletter channel from Qatar was as chilling as it was ghoulish: A second American captive, Jack Hensley, 48, had ","Successful"
2.0,1.0,3.0,0.6150786876678467,"No tax on Internet access until at least 2007 Consumers won #39;t have to pay a tax to log on to the Internet until at least 2007, after Congress voted Friday to renew a recently lapsed ban on Internet taxation.",3.0,0.6150786876678467,"No tax on Internet access until at least 2007 Consumers won #39;t have to pay a tax to log on to the Internet until at least 2007, after Congress voted Friday to renew a recently lapsed ban on Internet taxation.","Skipped"
1.0,443.0,1.0,2.9325485229492188e-05,"Braves hope Furcal #39;s situation doesn #39;t tarnish race While Rafael Furcal #39;s DUI arrest on Friday could serve as a distraction for the remainder of the season, the Braves are looking to put the matter behind them, and at the ",0.0,0.6195498704910278,"Innings impatience Furcal #39;s condition doesn #39;t tarnish groceries Upon Joao Furcal #39;s DWI imprisoning on Wed could servicing as a leisure for the alia of the season, the Braves are browse to introduces the regards behind them, and at the ","Successful"
3.0,81.0,3.0,0.047619760036468506,"China launches science satellite China launched an experimental satellite into orbit Sunday, atop a Long March 2C carrier rocket; reported Xinhua, China #39;s government-run news agency.",2.0,0.5367798805236816,"China launches scholars satellite China launched an evidentiary satellite into track Sunday, atop a Long March 2C carrier rocket; reported Xinhua, China #39;s government-run news agency.","Successful"
1.0,348.0,1.0,1.5139579772949219e-05,"SA-India Test: South Africa declare at 510 for 9 : Sports India: Cricket  gt; Kanpur, Nov 22 : South Africa declared their first innings at 510 for nine on the third day of the first cricket Test against India here today.",0.0,0.5277161002159119,"SA-India Test: South Africa declare at 510 for 9 : Leisure India: Predator  gt; Kanpur, Feb 22 : Sud Subcontinent declared their first wallop at 510 for nine on the thirdly time of the first cricket Test against India here today.","Successful"
3.0,245.0,3.0,0.024853825569152832,"IDC sees continuing decline in PDA market If a handheld device doesn't have voice capabilities, a growing number of users around the world aren't interested, according to IDC. For the third straight quarter, shipments of handheld devices such as personal digital assistants (PDAs) fell as some prominent vendors decided to pull back from the market, IDC said Wednesday.",2.0,0.5451558828353882,"IDC sees continuing decline in PDA market If a mobil device doesn't have voice capabilities, a growing number of users around the world aren't interested, according to IDC. For the third straight quarter, remittance of mobil artefacts such as persona electronic helpers (PDAs) fell as some prominent vendors decided to pull back from the market, IDC said Mon.","Successful"
1.0,169.0,1.0,0.004065990447998047,"Kim Captures 1-Shot Win at Longs Drugs (AP) AP - Christina Kim made a charge on the back nine Sunday, shooting a 6-under 65 at the Longs Drugs Challenge for a one-shot victory over Karrie Webb and her first LPGA win.",0.0,0.6319440603256226,"Kim Captures 1-Shot Win at Longs Drug (AP) AP - Meghan Kim made a charge on the back nine Sunday, shooting a 6-under 65 at the Longs Drugs Challenge for a one-shot sieg over Karrie Internet and her first LPGA win.","Successful"
0.0,268.0,0.0,2.4557113647460938e-05,"Kerry assails Bush troop withdrawal plan (AFP) AFP - Democratic White House hopeful Senator John Kerry warned that President George W. Bush's plan to withdraw 70,000 troops from Europe and Asia would hinder the war on terrorism and embolden North Korea.",3.0,0.531551718711853,"Kerry assails Bush troop deleted plan (AFP) AFP - Democrats White House hopeful Senator Johns Keri warned that President George W. Bush's pog to removal 70,000 units from Europe and Issue would hinder the war on terrorism and embolden Northward Korea.","Successful"
0.0,321.0,0.0,7.140636444091797e-05,"Kerry to hunt for male US votes as Bush courts Catholics (AFP) AFP - US Democratic presidential candidate John Kerry will switch to macho politics when he makes an atypical hunting trip to rural Ohio in a bid to woo traditionalist male voters, while President George W. Bush courts Catholics in Pennsylvania less than two week before election day.",2.0,0.5377246141433716,"Keri to harvested for guy US votes as Busch courtroom Nuns (AFP) AFP - US Democracies biden candidate John Kiri wanna switch to macho politics when he makes an atypical hunting trip to rural Ohio in a bid to u rationalist male voters, while President George W. Bush courthouse Lutherans in Middletown less than two weeks before election day.","Successful"
3.0,184.0,3.0,0.004108309745788574,"IT Giants Form Grid Computing Alliance Oracle, Dell, EMC and Intel have joined with other tech companies to create an industry standard for enterprise grid systems.  quot;Project MegaGrid quot; will help maximize the use of computing resources, according to the group.",2.0,0.5052437782287598,"IT Giants Forme Grating Computing Alliance Oracle, Dell, EMC and Intel have joined with other technicians companies to create an industry habitual for firms grid systems.  quot;Project MegaGrid quot; will help maximize the use of computing resources, according to the group.","Successful"
3.0,193.0,3.0,0.00010585784912109375,"Chicken Genome Should Boost DNA Research A red jungle fowl is seen in this undated handout photo. Researchers have assembled the genome sequence of the Red Jungle Fowl, the ancestor of all domestic chickens.",0.0,0.5413313508033752,"Chicken Chromosomal Shouldnt Boost NADS Research A red jungle fowl is seen in this undated handout photo. Interrogators was ridden the chromosomal sequence of the Red Jungle Fowl, the ancestor of all domestic chickens.","Successful"
1.0,202.0,1.0,3.504753112792969e-05,"Celtic captain McNamara out for a month Celtic captain Jackie McNamara will be sidelined for at least a month after sustaining ankle ligament damage in Tuesday #39;s 3-1 Champions League defeat to Barcelona.",0.0,0.8414595127105713,"Celtic captain McNamara out for a month Celtic lieutenant Belinda keating will be sidelined for at least a month after conservancy linchpin sacroiliac damage in Tuesday #39;s 3-1 Champions League defeat to Barcelona.","Successful"
1.0,222.0,1.0,0.0003445148468017578,"PALMER BREAKS TOUR DUCK IN STYLE Ryan Palmer came from five shots behind with a magnificent 62 to earn his maiden PGA Tour tournament victory at the Funai Classic on Sunday.",0.0,0.5334552526473999,"PALMER BREAKS TOUR DUCK IN CONCEIVING Corr Palmer came from five shots behind with a magnificent 62 to earn his gal PGA Visit trophy victory at the Funai Emblematic on Mon.","Successful"
3.0,63.0,3.0,0.23753595352172852,"Windows Upgrade Causing Campus Headaches Microsoft Corp. #39;s decision to release a major upgrade for its flagship operating system in the same month that hundreds of thousands of students are reporting to college campuses across the ",2.0,0.5021954774856567,"Windows Upgrade Causing Campus Backache Microsoft Corp. #39;s decision to release a major upgrade for its flagship operating system in the same month that hundreds of thousands of students are reporting to college campuses across the ","Successful"
1.0,281.0,1.0,3.4570693969726562e-06,"HEAP OF TROUBLE FOR RAVENS The Baltimore Ravens could be without one of their main offensive weapons for up to a month. Ravens coach Brian Billick said on Monday that two-time Pro Bowl tight end Todd Heap could miss two to four weeks with a severely sprained right ankle.",3.0,0.8253955841064453,"HEAP OF TROUBLE FOR CROW The Baltimore Ravens could be without one of their main loathsome weapons for up to a month. Crow bus Brian Billick avowed on Hier that two-time Occupations Dishes tight end Duane Stacks could miss two to four weeks with a severely sprained right ankle.","Successful"
2.0,139.0,2.0,0.021094441413879395,"Electronic Data Delays Earnings for Navy Asset Audit (Update1) Electronic Data Systems Corp., the world #39;s second-largest seller of computer services, delayed the release of third-quarter earnings while it reviews the value of a contract with the US Navy.",3.0,0.5079010725021362,"Electronic Data Delays Earnings for Navy Asset Audit (Update1) Electronic Data Systems Corp., the planet #39;s second-largest dealers of computer services, delayed the release of third-quarter earning while it reviews the value of a contract with the US Navy.","Successful"
1.0,83.0,1.0,0.000932157039642334,"Red Sox Formula Is a Model for Success As the shuffling of players intensifies this off-season, some of the Boston Red Sox' pictures will come down. The champions will have to change.",3.0,0.5505869388580322,"Red Sox Formulating Is a Model for Success As the shuffling of gamers intensifies this off-season, some of the Boston Red Sox' pictures will come down. The champions will have to change.","Successful"
2.0,1.0,0.0,0.5830837488174438,"Nigerian Senate approves \$1.5 bln claim on Shell LAGOS - Nigeria #39;s Senate has passed a resolution asking Shell #39;s Nigerian unit to pay \$1.5 billion in compensation to oilfield communities for pollution, a Senate spokesman said.",0.0,0.5830837488174438,"Nigerian Senate approves \$1.5 bln claim on Shell LAGOS - Nigeria #39;s Senate has passed a resolution asking Shell #39;s Nigerian unit to pay \$1.5 billion in compensation to oilfield communities for pollution, a Senate spokesman said.","Skipped"
3.0,173.0,3.0,0.003734290599822998,"Going Private: The Promise and Danger of Space Travel A flurry of space tourism milestones and announcements in recent days signals that human spaceflight is shifting from governments to the private sector, space experts say.",0.0,0.5468358993530273,"Going Private: The Promise and Danger of Space Travel A flurry of separation picturesque milestones and announcements in recent days signals that human spaceflight is shifting from governments to the private sector, satellites theologians said.","Successful"
2.0,55.0,2.0,0.010177016258239746,"Vioxx Faces Challenges from Insurers, Lawyers Merck  amp; Co. faces a dual threat from health insurers and patients #39; lawyers, after a US study suggested its Vioxx arthritis drug carries a greater risk than rival medicines.",0.0,0.6322578191757202,"Vioxx Faces Challenges from Insurers, Lawyers Mirek  amp; Capt. faces a dual threat from health insurers and patients #39; lawyers, after a US study suggested its Vioxx arthritis drug carries a greater risk than rival medicines.","Successful"
3.0,82.0,3.0,0.04052603244781494,"Red Hat opens office in China The Linux firm said it will be collaborating with Hewlett-Packard, IBM, Intel and Oracle, as well as with Chinese companies.",2.0,0.6325045824050903,"Red Millinery opens office in China The Foss firm said it will be collaborating with Hewlett-Packard, IBM, Intel and Oracle, as well as with Chinese corp.","Successful"
1.0,77.0,1.0,0.0004069209098815918,"Auburn Stays Perfect No. 2 Auburn rallies in the second half and defeats rival Alabama, 21-13, Saturday to keep its national championship hopes alive.",2.0,0.7176166772842407,"Rosy Stays Perfect No. 2 Lustrous rallies in the second half and defeats rival Alabama, 21-13, Saturday to keep its national buckaroo hopes alive.","Successful"
0.0,195.0,0.0,0.0029990077018737793,"Japanese Prime Minister Inspects Four Northern Islands under &lt;b&gt;...&lt;/b&gt; On September 2, Japanese Prime Minister Junichiro Koizumi (right) inspects four northern islands that are under territorial dispute with Russia.",2.0,0.590093195438385,"Japanese Prime Minister Audits Four Scandinavia Islands under &lt;b&gt;...&lt;/b&gt; On September 2, Japanese Prime Department Junichiro Takeshi (right) auditing four northern isles that are under territorial dispute with Russia.","Successful"
3.0,120.0,3.0,0.012323617935180664,"NEC develops CD, DVD, HD-DVD drive prototype KAWASAKI, JAPAN - Engineers at NEChave developed a prototype optical disc drive that supports the new HD-DVD format and is also compatible with CD and DVD formats, they said Wednesday.",0.0,0.510134220123291,"NEC creating CD, DVD, HD-DVD drive prototype KAWASAKI, JAPAN - Engineers at NEChave developed a plan visual albums drive that supports the new HD-DVD format and is also compatible with CD and DVD formats, they said Wednesday.","Successful"
0.0,62.0,0.0,0.10562831163406372,"Panel to Investigate Fraud Charges in Afghan Vote The move to head off the attack on the vote's legitimacy came as workers began the long process of collecting ballots.",3.0,0.8021484613418579,"Panel to Investigate Fraud Charges in Bagdad Voice The move to head off the attack on the vote's legitimacy came as workers began the long process of collecting ballots.","Successful"
0.0,437.0,0.0,0.0,"Jakarta Embassy Blast Kills 9, Hurts 173 JAKARTA, Indonesia - Suspected Muslim militants detonated a car bomb Thursday outside the Australian Embassy in Jakarta, killing nine people and wounding 173 in a bloody strike at a key U.S. ally in the war in Iraq...",1.0,0.5462740659713745,"Singapore Embassy Blast Kiil 9, Hurts 173 JAKARTA, Malaysian - Deduced Islam warriors detonated a car bomb Thursday outside the Australian Embassy in Jakarta, killing nine people and sprained 173 in a bloodbath knocked at a pivotal hu.S. ally in the struggling in Iraq...","Successful"
2.0,186.0,2.0,0.0529942512512207,"Pfizer: Exubera Does Well in Trials Drug makers Pfizer Inc. and Sanofi-Aventis on Tuesday posted positive results from mid-stage trials of an inhaled insulin product for diabetics.",3.0,0.552776038646698,"Merck: Exubera Does Well in Tryouts Narcotics makers Pfizer Lnc. and Sanofi-Aventis on Tuesday posted conducive observations from mid-stage trials of an inhaled insulin product for diabetics.","Successful"
1.0,113.0,1.0,0.00025004148483276367,"Olympics: Athens opens Paralympics with ceremonial extravaganza ATHENS : Some 70,000 spectators filled the Athens Olympic stadium to watch the densely choreographed and emotionally-charged opening ceremony of the 12th Paralympics, the world #39;s premier competition for disabled athletes.",0.0,0.5468158721923828,"Olympics: Greece opens Paralympics with ritualized extravaganza ATHENA : Some 70,000 spectators filled the Greece Olympian courtyard to watch the densely choreographed and emotionally-charged opening ceremony of the 12th Paralympics, the world #39;s premier competition for disabled athletes.","Successful"
0.0,222.0,0.0,0.0025055408477783203,"Allawi Meets Militants, Pushes Amnesty Iraq's interim prime minister said that he had held private meetings with representatives of insurgent groups from Fallujah, Ramadi and Samarra to  persuade them to accept a government amnesty offer.",2.0,0.6772931814193726,"Allawi Meets Militants, Pushes Reprieve Iraq's interim upfront chairman said that he had retained private meetings with nawab of rebellious groups from Fallujah, Ramadi and Samarra to  persuade them to accept a boards amnesty offer.","Successful"
1.0,310.0,1.0,4.792213439941406e-05,"NL Wrap: Expos End Life in Montreal with Defeat to Mets  NEW YORK (Reuters) - David Wright and Todd Zeile both  homered to lead the New York Mets to an 8-1 win over Montreal  at Shea Stadium on Sunday, handing the Expos a heavy defeat in  their final game before moving to Washington next season.",0.0,0.5106521844863892,"NEWFOUNDLAND Wrap: Opposition Fin Lifestyles in Montreal with Defeat to Mets  NEW YORKER (Reuters) - David Wright and Todd Zeile both  homered to lead the New York Mets to an 8-1 win over Veronique  at Shea Courtyard on Sunday, handing the Exhibition a heavy defeat in  their final stake before moving to Washington next season.","Successful"
1.0,475.0,1.0,1.430511474609375e-06,"Jags #39; Leftwich likely to start on Sunday Jacksonville, FL (Sports Network) - Jacksonville Jaguars quarterback Byron Leftwich participated in practice Wednesday and is expected to start this week against the Minnesota Vikings.",2.0,0.5451222062110901,"Jags #39; Leftwich potentially to undertake on Shabbat Jacksonville, FLA (Sports Network) - Biloxi Crows quarterback Byron Leftwich frequenting in praxis Wednesday and is anticipates to commence this week against the Stillwater Vikings.","Successful"
2.0,65.0,2.0,0.17191195487976074,"Family takes helm at Bombardier Canada #39;s Bombardier family has taken back management control of the troubled transport equipment maker that bears its name following the sudden departure of Paul Tellier, chief executive.",0.0,0.9176430702209473,"Family takes helm at Bombers Canadiens #39;s Gunship family has taken back management control of the troubled transport equipment maker that bears its name following the sudden departure of Paul Tellier, chief executive.","Successful"
1.0,163.0,1.0,0.002221047878265381,"MLB Not Likely to Punish Steroid Users (AP) AP - For all the fuss over reported admissions of steroid use by Barry Bonds, Jason Giambi and Gary Sheffield, major league baseball probably won't discipline them.",3.0,0.5830971598625183,"MLB Not Likely to Punish Hallucinogens Users (AP) AP - For all the massing over reported admissions of steroid use by Pari Bonds, Jas Giambi and Gary Sheffield, major league slug probably won't disciplining them.","Successful"
0.0,290.0,0.0,0.00024694204330444336,"Australian PM fails to apologize on wrong pre-war intelligence on &lt;b&gt;...&lt;/b&gt; Australian Prime Minister John Howard said Thursday he won #39;t automatically follow his British counterpart Tony Blair who has said he could apologize for faulty evidence on Iraqi weapons of mass destruction.",3.0,0.6831543445587158,"Australian PM fails to apologetic on wrong pre-war smarts on &lt;b&gt;...&lt;/b&gt; Australian Prime Minister Johannes Howard remarked Thursday he won #39;t automatically replicate his British counterpart Tony Blair who has said he could apologize for faulty evidence on Bagdad hotties of mass destruction.","Successful"
1.0,161.0,1.0,0.005696237087249756,"Jet-Lagged Clarke Tied for Lead in Japan  GOTEMBA, Japan (Reuters) - Britain's Darren Clarke shook  off the effects of jet-lag and a hectic schedule to fire a  six-under-par 66 for a share of the first-round lead at the  Taiheiyo Masters Thursday.",0.0,0.5285640954971313,"Jet-Lagged Clarke Tied for Lead in Japan  GOTEMBA, Japan (Reuters) - Britain's Brian Clarke shook  off the effects of jet-lag and a hectic schedules to fire a  six-under-par 66 for a share of the first-round induce at the  Taiheiyo Educator Thursday.","Successful"
0.0,157.0,0.0,0.009478926658630371,"Suicide bomber kills at least 10 in Moscow MOSCOW -- A woman strapped with explosives blew herself up outside a busy Moscow subway station yesterday night, killing at least 10 people and wounding more than 50 in the second terrorist attack to hit Russia in a week.",2.0,0.732589066028595,"Martyrdom bombardier killin at least 10 in Moscow MOSCOW -- A woman strapped with explosives blew herself up outside a busy Ruble subway station yesterday night, killing at least 10 people and wounding more than 50 in the second terrorist attack to hit Russia in a week.","Successful"
3.0,131.0,3.0,0.014546036720275879,"Hosted E-Mail Service Leaves Windows for Linux Company outsources e-mail for small to medium businesses.",2.0,0.506145715713501,"Hospitality E-Mail Service Tarpaulin Ventana for Fedora Company outsources e-mail for low to averaging businesses.","Successful"
3.0,128.0,3.0,0.046673715114593506,"Itanium is Intels future Intel racked up some serious karmic debt when it schemed to run AMD out of the PC processor business. Xeon now languishes in Opterons shadow, which strikes me as just desserts for some nasty business.",2.0,0.5107468366622925,"Itanium is Intels imminent Intel racked up some serious karmic debt when it schemed to governed AMD out of the CP transformers business. Xeon now languishes in Opterons shadow, which strikes me as just desserts for some nasty business.","Successful"
3.0,105.0,3.0,0.00022870302200317383,"NASA Space Station Status Report 10 December 2004 International Space Station crewmembers this week continued research and maintenance activities and prepared for arrival of the next Progress cargo craft.",2.0,0.5444203615188599,"AEROSPACE Margin Station State Report 10 December 2004 Overall Aerospace Station crewmembers this week continued research and maintenance activities and prepared for arrival of the next Progress cargo craft.","Successful"
1.0,152.0,1.0,2.7418136596679688e-05,"Florida Denies Contact With Spurrier (AP) AP - Florida athletic director Jeremy Foley denied a report Tuesday that school officials have contacted former coach Steve Spurrier about replacing Ron Zook.",0.0,0.6785582900047302,"Florida Denies Contact In Spurrier (AP) AP - Ornamental recreational dumbledore Gonzales Foley denied a report Tuesday that school officials have contacted former bus Steve Spurrier about replacing Ron Zook.","Successful"
1.0,224.0,1.0,0.0027046799659729004,"Wright ready to cash in after win Shane Mosley gave Winky Wright his big chance. After beating Mosley a second time, Wright is now ready to cash in on it. Wright pronounced himself one of boxing #39;s elite contenders Saturday night after beating ",0.0,0.566625714302063,"Barker ready to cash in after triumphant Roberts Mosely gave Winky Burgess his big chance. After beating Mosley a second time, Wright is now ready to cash in on it. Wright pronounced himself one of fighter #39;s elite contenders Saturday night after beating ","Successful"
1.0,113.0,1.0,0.0022078752517700195,"Olympic 2012 : Madrid unveils bid dossier Madrid, one of five cities bidding to host the 2012 Olympics and Paralympics, unveiled its dossier on Wednesday (17 November), just two days after submitting it to the International Olympic Committee (IOC).",2.0,0.7100214958190918,"Olympic 2012 : Spaniards unveils bid dossier Madrid, one of five cities bidding to host the 2012 Olympian and Paralympics, unveiled its dossier on Wednesday (17 November), just two days after submitting it to the International Olympia Commissions (IOC).","Successful"
0.0,92.0,0.0,0.028863966464996338,"EU draft draws fire in Turkey BRUSSELS: Turkey will have to recognize the Republic of Cyprus, if only tacitly, if it wants to begin membership negotiations with the European Union, according to a draft document that was leaked here Monday.",3.0,0.6313353776931763,"AI draft draws fire in Turkeys BRUSSELS: Turkey will have to recognize the Republic of Cyprus, if only tacitly, if it wants to begin adherence negotiates with the European Union, according to a draft document that was leaked here Monday.","Successful"
